Product,Price,Seller,Location,Sold,Rating
tali Hoodie premium bulat,Rp4.500,Yoyo_Store5,Tangerang,30+ terjual,5.0
sweater hoodie Pria Original Koozo,Rp64.190,KOOZO Official Shop,Kab. Bandung,750+ terjual,4.9
tali Hoodie aglet plastik full black,Rp3.500,Yoyo_Store5,Tangerang,30+ terjual,4.8
KREMLIN Cyber Techwear Pullover Hoodie - HAYABUSA,Rp549.900,KremlinOfficial,Bandung,250+ terjual,5.0
tali switer/tali Hoodie/tali celana,Rp4.500,Yoyo_Store5,Tangerang,1rb+ terjual,4.9
Breakside Hoodie Blacknight - Black,Rp199.000,Breakside,Kab. Bandung,250+ terjual,4.9
Epidemic Pullover Hoodie 330 Gsm Freedom Start Here Black,Rp296.250,EpidemicStreetwear,Bandung,13 terjual,5.0
Hoodie jersey save palestine kaos baju palestina islami Al Qassam pjng,Rp150.000,Listons-cloth,Semarang,4 terjual,5.0
Straight Vision - STAR Hoodie Black- Hoodie hitam Distro Hoodie Pria,Rp219.900,Straight Vision,Bandung,16 terjual,4.8
Black Hoodie BMW M-Motorsport Original Import,Rp470.400,bimbimco,Bandung,7 terjual,5.0
Sweater Hoodie Cokelat Kopi,Rp135.000,hoodie addict,Bandung,30+ terjual,4.9
Tali hoodie h&m,Rp3.000,Yoyo_Store5,Tangerang,60+ terjual,5.0
Breakside Hoodie Good Vibes - Black Hoodie Pria,Rp220.000,Breakside,Kab. Bandung,4 terjual,4.5
tali hoodie merah,Rp3.500,Yoyo_Store5,Tangerang,15 terjual,5.0
Sweater Hoodie Pria Original Koozo Logo / jaket Pria terbaru Koozo,Rp64.190,KOOZO Official Shop,Kab. Bandung,70+ terjual,4.8
TALI HOODIE AGLETS WARNA BURGUNDY/MARON TUA,Rp3.500,Yoyo_Store5,Tangerang,50+ terjual,4.9
Hoodie Kappa,Rp175.000,PremiumTime02,Cimahi,,
FMC Zipper Hoodie Jacket C010624,Rp279.000,3Second Official,Bandung,6 terjual,4.6
SWEATER JAKET HOODIE ZIPPER MLB LOGO NY ARMY PREMIUM AUTHENTIC BLACK,Rp159.999,ROUTE88STORE,Bandung,4 terjual,5.0
Paradise Youth Club - Mind Control Hoodie - Misty Grey,Rp240.000,KMI Warehouse,Tangerang,5 terjual,5.0
CARTEXBLANCHE - Duckstronout Jaket Hoodie Jumper Bordir Unisex,Rp92.400,CARTEXBLANCHE,Jakarta Barat,7 terjual,5.0
HOODIE GRIMLOC - COLLAGE,Rp415.000,tycusgoth store,Kab. Magelang,1 terjual,5.0
Drew House Mascot Solid Hoodie,Rp335.300,Sangkilco,Tangerang,14 terjual,5.0
Jaket Hoodie Pria Cressida The Next Level KB025Y - Navy,Rp282.320,Cressida The Next Level,Bandung,10 terjual,5.0
Hoodie Boxy Chambredelavain - CHMB Basic,Rp499.000,Local Rare Item,Kab. Cilacap,10 terjual,5.0
Aerostreet Hoodie Zipper Nevio Hijau Sweater Jumper CCBAA,Rp169.900,Aerostreet,Kab. Klaten,14 terjual,5.0
HOODIEPOLOS - ZIP HOODIE POLOS BAHAN FLEECE UNISEX CEWEK / COWOK,Rp89.500,Hoodiepolos_id,Tangerang,9 terjual,5.0
tali Hoodie motif ujung aglet / tali Hoodie motif premium,Rp3.750,Yoyo_Store5,Tangerang,4 terjual,5.0
KREMLIN Zipper Hoodie Sleting Glow In The Dark - Genos,Rp349.900,KremlinOfficial,Bandung,250+ terjual,5.0
tali hoodie flat aglets warna putih,Rp4.500,Yoyo_Store5,Tangerang,24 terjual,5.0
Breakside Hoodie Kitsune Street - Black,Rp204.900,Breakside,Kab. Bandung,80+ terjual,4.9
Russ Sweater Hoodie Squadro Cream,Rp199.000,Russ & Co.,Bandung,29 terjual,4.9
Kepomp Hoodie Cotton Fleece Hitam Polos Eksklusif,Rp269.900,KEPOMP,Tangerang,100+ terjual,4.8
SWEATER HOODIE PRIA ROMPI HOODIE ZIPPER JUMBO,Rp75.000,Jack wolkcin kolection,Kab. Garut,250+ terjual,4.9
HARLEY DAVIDSON GENUINE HOODIE CHECKERED SLEEVE PULLOVER 99031,Rp1.460.000,TIPTOP Proshop,Surabaya,2 terjual,5.0
Hoodie Vans krooked By natas For Ray barbee,Rp599.000,Weekendhype_id,Bekasi,1 terjual,
Noir Sur Blanc Men Raglan Hoodie White,Rp450.000,NOIR SUR BLANC,Depok,1 terjual,5.0
MILLS Jacket Olahraga Cross Hoodie 2.0 31006,Rp259.350,MILLS Official,Kab. Tangerang,17 terjual,4.8
Stussy Basic Ash Heather Zipper Hoodie (100% Authentic),Rp1.399.000,senikersku_id,Surabaya,11 terjual,5.0
Levi's Men's Authentic Hoodie (A8435-0004),Rp899.900,Levi's Official,Tangerang,6 terjual,5.0
Hammerstout Jaket Hoodie Hitam Lame,Rp258.300,Hammerstout,Bandung,7 terjual,4.8
tali Hoodie ujung metalik x tali Hoodie ujung karet,Rp4.000,Yoyo_Store5,Tangerang,100+ terjual,5.0
Rown Division Jaket Hoodie Polos Parsons Black - S,Rp169.000,Rown Division Store,Surakarta,60+ terjual,4.8
tali hoodie/jaket/switer jumper meteran harga grosir,Rp2.000,Yoyo_Store5,Tangerang,50+ terjual,5.0
ODS Comfort Hoodie Smokey Green,Rp259.000,ODS Stores,Bandung,30+ terjual,4.9
tali Hoodie/tali celana flat aglet,Rp4.000,Yoyo_Store5,Tangerang,250+ terjual,5.0
Jaket W.Essentiels Belcastel Oversize Hoodie Noir Black Essentiels,Rp503.100,Wormhole Store,Bandung,40+ terjual,4.9
SWEPO Hoodie Jumper BKLYN (Bordir) Size M-XXL (Pria & Wanita),Rp88.900,SWEPO Official Store,Kab. Tangerang,25 terjual,4.7
Jaket hoodie MSC116 series 2022 Mantra Summit Challenge limited Size S M L,Rp350.000,kaldera13outdoor,Batu,1 terjual,5.0
JAKET SWEATER HOODIE BAPE SHRAK WGM x PSG FULL TAG & LABEL FULL ZIPPER,Rp245.000,ROUTE88STORE,Bandung,13 terjual,5.0
Hoodie Gengar Pokemon Embroidery,Rp275.000,Kudou Animanga,Medan,,
Oversized Gymshark Hoodie (dari UK),Rp1.549.000,Ben's Winkel,Jakarta Pusat,3 terjual,5.0
Okechuku JEFRY Sweater Hoodie JUMPER BIGSIZE JUMBO Bahan FLEECE,Rp49.900,Okechuku,Jakarta Barat,100+ terjual,4.7
Hammerstout Jaket Hoodie Biru Chroma Blue Hoodie,Rp258.750,Hammerstout,Bandung,10 terjual,5.0
Cosmic Sweater Hoodie QUANTER MAROON,Rp220.000,COSMICCLOTHES,Bandung,7 terjual,5.0
Zipper Sweat Hoodie Champion Original JP-Market (C3-Q106) UNISEX,Rp169.000,LUNATIC BRANDED,Kab. Bekasi,30+ terjual,4.4
Insurgent Club - Rough Logo Hoodie Black,Rp359.000,Insurgent Club,Bandung,100+ terjual,4.9
Gozeal | Hoodie Boxy | Washed Grey,Rp300.000,Gozeal Official Store,Serang,11 terjual,5.0
SWEATER HOODIE PLAYSTATION PREMIUM AUTHENTIC FULL TAG & LABEL HITAM,Rp159.999,ROUTE88STORE,Bandung,40+ terjual,4.4
Dobujack Vyse Black Hoodie,Rp194.000,DOBUJACK,Bandung,8 terjual,4.8
GRADE ORIGINAL - M L XL XXL XXXL - Jaket Hoodie AHHA Barong Premium,Rp125.000,ALMYRA22OFFICIAL,Bandung,8 terjual,4.5
HOODIE RABBIT AND WHEELS QUIET || ORIGINAL,Rp700.000,budin_geseng,Kab. Cilacap,15 terjual,5.0
RIP N DIP Multi Hoodie White RIPNDIP,Rp1.299.000,Wormhole Store,Bandung,3 terjual,5.0
OBLO Hoodie Boxy Zipper Pria Cotton Fleece 330gsm,Rp189.000,Obloofficialstore,Bekasi,9 terjual,5.0
Hoodie Boxy oversize Fillingstreet - Basic Derby Black,Rp299.999,fillingstreet,Yogyakarta,26 terjual,5.0
Denim Tears - The Cotton Wreath Black Hoodie,Rp1.800.000,6SOF,Jakarta Barat,3 terjual,5.0
Kalibre | Coca-Cola Hoodie Black 970494,Rp575.000,Kalibre Official Shop,Bandung,7 terjual,5.0
HOOLIGANS Hoodie Bold Speziale - Misty,Rp198.800,HOOLIGANS,Bandung,70+ terjual,5.0
MARCELO BURLON WINGS REGULAR HOODIE BLACK BLUE SS20,Rp4.199.000,Badass Monkey Indonesia,Jakarta Selatan,,
Covernat Small Authentic Logo Zip-Up Hoodie,Rp279.300,Dario ID,Tangerang,4 terjual,5.0
Russ Short Sweater Hoodie Buddies Green,Rp190.000,Russ & Co.,Bandung,10 terjual,4.8
HOODIE CONVERSE ONE STAR MENS ORIGINAL,Rp280.000,@D_originalshoes,Tangerang Selatan,7 terjual,5.0
hoodie kawasaki ninja,Rp250.000,Racingcore,Kab. Bandung,25 terjual,5.0
JAKET RRQ HOSHI TERBARU Vol 5 SEASON 10 2022 HOODIE BIG SIZE DEWASA,Rp190.000,LSARI FRY,Kab. Blitar,18 terjual,4.9
Insurgent Club - Hoodie College Mirror Brown,Rp359.000,Insurgent Club,Bandung,30+ terjual,5.0
Steigen Pullover Hoodie Fleece Mint,Rp130.000,Steigen official,Bandung,10 terjual,5.0
Insurgent Club - Breakfast Hoodie Black,Rp359.000,Insurgent Club,Bandung,60+ terjual,4.9
SP5DER Beluga Hoodie Slate Grey,Rp1.550.000,6SOF,Jakarta Barat,,
Hoodie pembangkang persebaya terbaru jaket persebaya bonek pembangkang,Rp79.900,Totalnekat merchandise,Surabaya,12 terjual,4.9
MONKL BLANK SWEATER HOODIE BABY TERRY PRIA ZIPPER ORIGINAL MB-07,Rp125.000,GrosirPakaianPria,Bandung,40+ terjual,
Hoodie Jumper Times ada Kantong Kiri Kanan Motif 2 Kombinasi Warna,Rp64.900,Lightdistro,Jakarta Barat,26 terjual,4.9
Best Hoodie Greenlight Sandwash Sweater tie dye Keren,Rp152.000,BEST HOODIE STORE,Kab. Bandung,,
stoper tali celana/stoper tali Hoodie ku,Rp500,Yoyo_Store5,Tangerang,250+ terjual,5.0
Promo sweater hoodie jumper outerwear pria wanita high quality 1821j,Rp99.000,OXPREY59,Jakarta Pusat,100+ terjual,4.7
tali Hoodie Jumper meteran macam warna / tali Jogger pipih,Rp2.000,Yoyo_Store5,Tangerang,40+ terjual,5.0
KREMLIN Pullover Hoodie Glow In The Dark - DARK GAROU,Rp349.900,KremlinOfficial,Bandung,250+ terjual,4.9
ODS Comfort Hoodie Coal Black - XL,Rp259.000,ODS Stores,Bandung,50+ terjual,4.8
Promo sweater hoodie jumper outerwear pria wanita high quality 886j,Rp99.000,OXPREY59,Jakarta Pusat,250+ terjual,4.7
KREMLIN Anime Rumble Pullover Hoodie - Monkey D. Luffy,Rp319.900,KremlinOfficial,Bandung,750+ terjual,5.0
sweater HOODIE GREENLIGHT dewasa original pria wanita kardigan,Rp125.000,BEST HOODIE STORE,Kab. Bandung,250+ terjual,4.6
KREMLIN Pullover Hoodie Glow In The Dark - Sun God nika,Rp349.900,KremlinOfficial,Bandung,250+ terjual,4.9
CARDINAL CASUAL JAKET ADVENTURE HOODIE 12,Rp399.000,Cardinal Official,Kab. Bandung,10 terjual,5.0
Hoodie Band Pria Metal | Rock | Klasik Rock | MY CHEMICAL ROMANCE,Rp94.999,Senja Home,Kab. Bekasi,3 terjual,4.0
JAKET HOODIE CBR 250 RR LOTTO BODYFIT HONDA HRC HOODIE SUNMORI,Rp330.000,Racingcore,Kab. Bandung,3 terjual,5.0
Hoodieku Hoodie Jumper Originals Hitam,Rp259.000,hoodieku official,Depok,100+ terjual,4.8
FTH x EVOS Pullover Tactical Hoodie,Rp575.000,Faith Industries,Bandung,30+ terjual,4.9
Hoodie Pullover Premium - Custom Design - MeowCotton,Rp349.000,MeowCotton,Jakarta Barat,5 terjual,5.0
Pullover Hoodie Essential Pria-Ad ds,Rp229.000,Authentic wearhouse,Bekasi,,
Insurgent Club - Innocent Hoodie Black,Rp359.000,Insurgent Club,Bandung,6 terjual,5.0
Jaket Sweater Hoodie Zipper STONE Pacth Premium Full Tag & Label Hitam,Rp159.999,ROUTE88STORE,Bandung,4 terjual,5.0
LinkaweOriginal Sletting Hoodie List Pria size M L XL XXL XXXL,Rp122.000,LinkaweOriginal,Bandung,100+ terjual,5.0
MILLS DYNAMIC HOODIE JACKET ORIGINAL,Rp299.000,Azzura 99,Tangerang,40+ terjual,5.0
Jaket hoodie pria Adidas 3 stripes full zipper hoodie - ic0433,Rp880.000,Run N Go Sport,Jakarta Pusat,1 terjual,5.0
Dobujack Freedom Of Speech Black Hoodie,Rp194.000,DOBUJACK,Bandung,22 terjual,4.8
ASSC Cancelled Hoodie Black - Black,Rp1.700.000,Yardsale by 707,Jakarta Pusat,3 terjual,5.0
Fairgoods Hoodie Boxy fit 320GSM Bound Deep Blue,Rp199.000,fairgoods,Kab. Bogor,,
Hakari Kinji Jujutsu Kaisen Hoodie,Rp250.000,ganbate,Yogyakarta,9 terjual,5.0
100% ORIGINAL CMT HOODIE H&M ETERNAL,Rp110.000,Popeyesneakers,Depok,100+ terjual,4.6
jaket hoodie original fila x vespa - man navy,Rp750.000,scooterzone,Depok,1 terjual,5.0
KITH Hoodie Outer Jacket Jaket,Rp230.000,MAM Markets,Kab. Serang,,
Steigen - Pullover Hoodie Origami | Cotton Fleece 280 Gsm,Rp199.000,Steigen official,Bandung,1 terjual,5.0
Common Goods Basic Pullover Hoodie - Black - M,Rp185.000,Common Goods,Jakarta Barat,250+ terjual,4.9
Sweater Hoodie Pria Original Koozo / Jaket Sweater hoodie,Rp64.190,KOOZO Official Shop,Kab. Bandung,80+ terjual,4.9
"SWEPO Hoodie Jumper End 90's (Sablon) Size M-XXL (Pria & Wanita) - Hitam, M",Rp94.900,SWEPO Official Store,Kab. Tangerang,10 terjual,4.7
HOODIE PRIA EGR JUMBO/HOODIE OVERSIZE S M L XL XXL XXXL 4XL 5XL,Rp120.000,Pradast,Kab. Blitar,2rb+ terjual,5.0
Sweater Hoodie Pria Wanita Motif New Travelling Jaket Unisex Outdoor Original M L XL 2XL,Rp125.000,Fashion Store Official16,Bandung,100+ terjual,5.0
HOODIE RIDING KEEPRIDEFUN NAKANO SHURIKEN SILVER JAKET MOTOR PULLOVER KEEP RIDE FUN,Rp800.000,THC Helmet Tangerang,Jakarta Barat,8 terjual,5.0
Prime Signature Hoodie MALE ID HEYMALE (READY SIAP KIRIM),Rp259.000,AFWINKEL,Jakarta Pusat,19 terjual,5.0
Aerostreet Hoodie Gratefull Hoodie Putih Sweater Jumper CBAAA,Rp139.900,Aerostreet,Kab. Klaten,100+ terjual,4.9
Hoodie Jacket Adidas Muhammad Ali,Rp375.000,tksembarangsmg,Semarang,1 terjual,5.0
Jaket Hoodie Racing Hell RH57 Printing Edisi Terbaru,Rp147.500,Galeri21,Kab. Bandung,3 terjual,5.0
Epidemic Hoodie Black Dementer,Rp296.250,EpidemicStreetwear,Bandung,11 terjual,4.8
Kalibre | Coca-Cola Hoodie Red 970495,Rp425.000,Kalibre Official Shop,Bandung,25 terjual,5.0
Hoodie Vans Peanuts Second,Rp200.000,Zweite_im,Kab. Bandung,,
Cosmic Sweater Hoodie Pria SPITFIRE ZIPPER BLACK,Rp260.000,COSMICCLOTHES,Bandung,3 terjual,
FOG Essentials 1977 Hoodie,Rp559.000,Sangkilco,Tangerang,30+ terjual,5.0
Breakside Hoodie Dark Wolf - Black - L,Rp199.000,Breakside,Kab. Bandung,60+ terjual,4.9
HOODIE EGR PRI JUMBO/ HOODIE OVERSIZE S M L XL XXL XXXL 4XL 5XL,Rp120.000,Pradast,Kab. Blitar,2rb+ terjual,5.0
Breakside Hoodie Queens - White - XL,Rp199.000,Breakside,Kab. Bandung,40+ terjual,4.7
Pullover Hoodie Rown Division Pagosa Misty - L,Rp439.000,Rown Division Store,Surakarta,60+ terjual,4.7
Breakside Hoodie Blackout - Black - XXL,Rp199.000,Breakside,Kab. Bandung,8 terjual,4.7
WTAPS Militia hodie zip m,Rp800.000,ytta branded,Jakarta Timur,,
JAKET HOODIE ZIPPER POLOS PREMIUM PRIA & WANITA,Rp90.000,story_jaket,Surabaya,750+ terjual,4.9
Praedae Studio Hoodie Eternals Navy,Rp429.000,Thirtyone_store,Jakarta Timur,1 terjual,
Hoodie exclusive SR-PROJECT RACING STORIES - BLACK RED,Rp467.000,Revs Motoshop Palembang,Palembang,16 terjual,5.0
ADIDAS Jaket Future Icons 3S FZ Q4 Hoodie XL BNWT Original 100%,Rp550.000,La Finale,Kab. Sukoharjo,,
Paket Setelan Atasan Hoodie dan Celana Joger Pria Fleece Premium,Rp105.500,Atjin,Bandung,8 terjual,5.0
M231 Hoodie Panjang Hijau 2197D,Rp149.000,M231 Official Store,Kab. Tangerang,40+ terjual,4.8
LONGSLEEVE HOODIE | ON STREET | KAOS LENGAN PANJANG | KAOS KUPLUK,Rp189.000,ZAVIER_MARKET,Kab. Bandung Barat,80+ terjual,4.9
Hoodie Exclusive SR-PROJECT Racing stories Blue,Rp445.000,SR-PROJECT Motogarage,Kab. Bogor,9 terjual,5.0
Jaket Hoodie F1 2024 Formula One Team McLaren Fullprint,Rp200.000,DISTRONGER_OFFICIAL,Semarang,8 terjual,5.0
toyota gazoo racing gazoo hoodie black,Rp800.000,Toyota Duta Cendana,Kab. Cianjur,,
Jaket Hoodie Polos Topfit Cotton Fleece,Rp69.000,Wonderprint,Jakarta Timur,100+ terjual,4.8
jaket hoodie NBA air jordan basketball premium terbaru,Rp108.700,Rery ID,Jakarta Barat,25 terjual,4.6
Jaket Hoodie Pria Cressida The Next Level HB034Y - Navy,Rp282.320,Cressida The Next Level,Bandung,4 terjual,5.0
Outerwear Hoodie Slvhx Nascar Weekly Series White,Rp175.000,RWKNDINC,Bandung,4 terjual,5.0
Tako Takodachi Face Hoodie Anime Hololive,Rp120.000,KAOS DISTRO 4U,Tangerang Selatan,13 terjual,4.9
Aerostreet Hoodie Alexander Abu Muda Sweater Jumper CBAAA,Rp159.900,Aerostreet,Kab. Klaten,100+ terjual,4.8
Oversized Boxy Hoodie Grey Misty,Rp189.000,Cottonsupply,Tangerang,100+ terjual,4.9
sweater jumper jaket Hoodie pria lengan pendek,Rp38.000,fbmarket,Jakarta Barat,100+ terjual,4.7
Zip Hoodie Band Official METALLICA - KILL 'EM ALL  Original,Rp980.000,wiztr,Malang,1 terjual,5.0
Hoodie Pria UNDER ARMOUR ESSENTIAL FLEECE 1373880391 ORIGINAL,Rp431.550,Sneakers Dept,Bekasi,3 terjual,5.0
Reclays Hoodie Doze Hoodie Purple,Rp129.000,Reclays Official Shop,Bandung,5 terjual,5.0
Jaket Sweater Hoodie Eiger Michigan Art.4775,Rp559.000,EAS Online,Tangerang,7 terjual,5.0
LIFEWORK Radog Big Logo Hoodie multi black,Rp1.180.000,sallangsallang,Kab. Tangerang,8 terjual,5.0
Dobujack Night Watch Black Hoodie,Rp194.000,DOBUJACK,Bandung,13 terjual,5.0
RIP N DIP SUPER SANERM HOODIE - M,Rp1.470.000,Yardsale by 707,Jakarta Pusat,,
FB7922 010 Mens Nike Tech Fleece Full Zip Windrunner Hoodie,Rp1.899.000,Nike Ating,Jakarta Selatan,10 terjual,5.0
Wildtime&Co - Hoodie Blackline Abstrack Black,Rp315.000,wildtimeofficial,Denpasar,2 terjual,5.0
Rabbit And Wheels Equinox Black Hoodie,Rp750.000,bikeprioritystore,Bandung,2 terjual,5.0
Aerostreet Hoodie Zipper Polos Cerah Sweater Jumper PBAAA,Rp169.900,Aerostreet,Kab. Klaten,100+ terjual,4.8
JAKET HOODIE TASLAN WATERPROOF HONDA HRC PCX 150 PCX 160 BIG SIZE,Rp350.000,Racingcore,Kab. Bandung,2 terjual,5.0
Cosmic Sweater Hoodie SHEIN,Rp220.000,COSMICCLOTHES,Bandung,30+ terjual,5.0
Jaket Bomber Hoodie Terbaru,Rp166.939,nazmudin store,Kab. Garut,15 terjual,5.0
HOODIE POLOS NAVY BASIC,Rp190.900,Kattoen.,Malang,80+ terjual,4.9
SWEATER HOODIE JAKET FULL ZIPPER BAPE SHARK AUTHENTIC FULL TAG & LABEL,Rp249.999,ROUTE88STORE,Bandung,6 terjual,5.0
Rown Division Jaket Hoodie Polos Parsons Misty - L,Rp169.000,Rown Division Store,Surakarta,40+ terjual,4.9
Breakside Hoodie Krosen - Black - M,Rp220.000,Breakside,Kab. Bandung,14 terjual,4.9
Insurgent Club - Hoodie Basic Misty,Rp350.000,Insurgent Club,Bandung,50+ terjual,4.7
Breakside Hoodie Crinkle - Black - M,Rp220.000,Breakside,Kab. Bandung,18 terjual,4.8
"Jaket Sweater Hoodie Pria Original KOOZO dengan 5 varian Warna - Hitam, L",Rp93.590,KOOZO Official Shop,Kab. Bandung,5 terjual,5.0
Breakside Hoodie Darkside - Black - XXL,Rp199.000,Breakside,Kab. Bandung,100+ terjual,4.8
Escaperfect Hoodie Simple Type Dvsn misty - XXL,Rp190.000,Escaperfect,Kab. Bandung,10 terjual,4.8
ODS Comfort Hoodie Oatmeal,Rp259.000,ODS Stores,Bandung,40+ terjual,4.9
"Moxie Jaket Pullover Gorpcore Shelter Hitam Black Jacket - HItam, XL",Rp199.800,Moxie Inconspiracy,Bandung,100+ terjual,4.8
HOODIE HITAM ITB PRESS X FOLK BDG,Rp299.000,ITB Press,Bandung,,
Jaket Hoodie Zipper MotoGP - ME Yamaha Factory / Jaket ME Yamaha Facto,Rp290.000,Magenta_Apparels,Kab. Bandung,5 terjual,5.0
POLO - 7900.61 Mens Hoodie Zip - Gray,Rp329.000,POLO Indonesia Official,Jakarta Barat,50+ terjual,5.0
CDG Play Red Heart Zip-Up Hoodie,Rp499.000,Sangkilco,Tangerang,25 terjual,4.8
CDL DESERT DREAMS FULL ZIP HOODIE - CALLE DE LARACHE,Rp753.000,kenzie2024,Bandung,,
Jaket Hoodie Sweater Vaque Jumper Fashion Pria Cowok Keren Premium,Rp75.000,queenlabel,Jakarta Barat,100+ terjual,4.7
Hoodie H&M Polos Basic Hitam Drak Grey Free Paper Bag Full Tag HnM,Rp105.000,RIOTBrand,Jakarta Timur,750+ terjual,4.8
House of Smith Sweater Hoodie Boxy Pria - Flock Black Boxy Heavyweight,Rp375.000,House of Smith Official,Kab. Bandung,1 terjual,
"Hoodie F0G-115 x A45  - Hitam, S",Rp598.000,Splitoff-id,Tanjung Pinang,1 terjual,5.0
"SWEATER HOODIE UKURAN JUMBO BIG SIZE XXL - XXXL ZEBRA CROSS-PUTIH - XXL, GOODTIMES BLACK",Rp95.000,Antares Store Official,Kab. Bandung,4 terjual,5.0
"MILLS Jaket Olahraga MK Sembrani Hoodie 1.0 31007MK - BLACK, XL",Rp291.850,MILLS Official,Kab. Tangerang,1 terjual,5.0
Chrome Hearts Arm Cross Patch Knitted Hoodie,Rp479.000,Sangkilco,Tangerang,10 terjual,5.0
[OUTERWEAR] Motorhead - England Pullover Hoodie,Rp600.000,quickening bandung,Bandung,,
Vitlexs Jaket Pria Hoodie Distro Cewek Cowok Terbaru Suiter Hodi Pria,Rp135.000,Vitlexs Official Shop,Kab. Bandung,22 terjual,4.8
Hierarchy Studios - Black Graffiti Wide Logo Oversized Hoodie,Rp399.000,Hierarchy Studios,Jakarta Barat,26 terjual,4.8
sweater hoodie EIGER X CAMPSIRE ORIGINAL CLEARANCE SALE,Rp275.000,wilis outdoor adventure,Kab. Bandung,,
Hoodie Jaket Zipper Switer Sleting Tosca Polos Pria Wanita M L XL XXL,Rp59.000,Aa Jacket,Kab. Bandung,1rb+ terjual,4.8
Hoodie Pria ELLESSE RUBBER TAPE MEN FULL ZIP HOODIE ELLMJH231BLK ORIGINAL,Rp699.300,Sneakers Dept,Bekasi,2 terjual,
Stylelaki  KLAFE Hoodie Fleece,Rp69.900,Stylelaki id,Kab. Kuningan,50+ terjual,4.9
Telepati.che Hoodie Kiss Me Black Original,Rp1.999.999,CIOSTORE.ID,Kab. Bekasi,17 terjual,5.0
Sweater Hoodie Premium Pria Distro Jaket Switer Tebal Flecce Hodie Ori,Rp69.300,Blessing Authentic,Bandung,30+ terjual,5.0
"HOODIE ADIDAS CLASSIC | JUMPER ADIDAS | SWEATER ADIDAS GRADE ORIGINAL - Hitam, M",Rp169.000,BATTLE STORE91,Kab. Bandung Barat,1 terjual,
"Supreme Color Blocked Jaket Zip Up Hoodie - Royal 100% Original - BLACK, M",Rp3.725.000,True OG Kicks,Kab. Tangerang,2 terjual,5.0
"New States Apparel ( NSA ) JAKET Hoodie Polos 9500 Import Original - BLACK, S",Rp160.000,Grosir clo,Jakarta Selatan,1rb+ terjual,4.9
"tali hoodie premium impor aglet. tali jaket premium ujung besi kapsul  - Hitam, 150 cm",Rp5.983,Arba'a Ex,Tangerang,30+ terjual,5.0
"Jaket Katun Pria Cowok Bolak balik Motor Impor Fashion Murah Adem - Cokelat, M",Rp200.000,DERIA SHOP,Jakarta Pusat,100+ terjual,4.9
Chambredelavain Hoodie - Limited Edition,Rp410.000,jeje_jakarta,Jakarta Selatan,1 terjual,5.0
Hoodie Polos Jumper Tebal Gramasi 280 Premium Unisex M - XXL,Rp66.900,BANDUNG POLOS.ID,Kab. Bandung,20 terjual,5.0
Sweater Hoodie polos pria wanita keren Trendy,Rp30.000,DELLTA8,Kab. Bandung,2 terjual,5.0
HDCI Hoodie Sweater Original Merchandise Harley Davidson,Rp800.000,Biker Jowo,Depok,,
HOODIE POLOS LENGAN PENDEK PREMIUM BAHAN COTTONTERY IMPOR,Rp29.900,Alcantara Apparel,Tangerang,23 terjual,4.3
Desmond Miles Hoodie from Assassin Creed 3,Rp350.000,ganbate,Yogyakarta,12 terjual,4.9
Roughneck H198 Black Sig Crocodillo Hoodie,Rp115.000,ROUGHNECK 1991 Official,Kab. Bogor,50+ terjual,4.6
Jaket Hoodie Big Size 2XL 3XL 4XL 5XL Zipper Hodie Jumbo Polos,Rp115.000,Toko Kaos Distro Premium,Jakarta Pusat,250+ terjual,4.9
Moxie Hoodie High School Unisex Fleece - Black on black,Rp169.800,Moxie Inconspiracy,Bandung,12 terjual,5.0
Sweater Hoodie Tamiya Dash Emperor,Rp179.000,Mosei Creative,Bandar Lampung,1 terjual,5.0
"Hoodie 6S1'-077 interlocking g logo - Hitam, S",Rp698.000,Splitoff-id,Tanjung Pinang,,
House of Smith Sweater Hoodie Pria - Blues Blue Black Blue - L,Rp99.000,House of Smith Official,Kab. Bandung,6 terjual,5.0
"Hoodie 6S1'-100 clasic logo motif black - Hitam, S",Rp598.000,Splitoff-id,Tanjung Pinang,,
Sweater Hoodie Jumper Hitam Black - M,Rp59.900,DD Gallery,Jakarta Pusat,1rb+ terjual,4.8
JAKET HOODIE ADIDAS CLASSIC GRADE ORIGINAL - SWEATER - klasik hitam,Rp167.310,DECLINE Official,Bandung,100+ terjual,4.8
Kepomp Hoodie Jumper Raglan Fleece Navy Abu Premium Quality,Rp149.900,KEPOMP,Tangerang,30+ terjual,4.8
Screamous Sweater Pria Pullover Zipper Hoodie LOGO CROWN OLD CML,Rp210.000,SCREAMOUS 55,Bandung,6 terjual,5.0
HOODIE ZODIAC ORIGINAL,Rp55.000,Merona Second,Jakarta Selatan,,
JAKET HOODIE ZIPPER BLUELOCK TOBUZOO  Ready Size S-6XL Pria Wanita,Rp150.350,WV_Jaket.Official,Kab. Blitar,3 terjual,5.0
Vans x Spitfire Hoodie Orange Flame,Rp1.299.000,Etaks.store,Jakarta Selatan,1 terjual,5.0
tali hoodie #tali celana meteran katun  harga untuk 5 meter,Rp10.000,dearma renda,Tangerang Selatan,60+ terjual,5.0
SWEATER HOODIE UKURAN JUMBO BIG SIZE XXL - XXXL - XXXXL ALL VARIAN 2,Rp95.000,Antares Store Official,Kab. Bandung,70+ terjual,4.7
Jaket Anime Game Assassin's Creed Grey Jacket Hoodie (JG ASC 03),Rp220.000,Wafi olshop,Yogyakarta,3 terjual,5.0
SWEATER HOODIE ROCK IT BAHAN FLEECE TEBAL,Rp70.000,Ls collection2,Jakarta Barat,70+ terjual,4.9
Hoodie Heritage HD Club Indonesia Official Merchandise,Rp1.299.000,rksneakers,Cirebon,8 terjual,5.0
SWEATER HOODIE ESSENTIALS HYPEBEAST AUTHENTIC PREMIUM FULLTAG & LABEL,Rp160.000,ROUTE88STORE,Bandung,15 terjual,4.7
1990s Polo Ralph Lauren Big Logo Horse Faded Black Distressed Hoodie - Unisex - M,Rp275.000,2000Tribe,Yogyakarta,,
Stussy Basic Hoodie Original Authentic,Rp2.800.000,needshoes1,Jakarta Timur,8 terjual,4.9
Hoodie Boxy oversize Fillingstreet - Angel made Brown,Rp329.999,fillingstreet,Yogyakarta,18 terjual,5.0
HOODIE FOR NSR ADDICT | HONDA NSR LIMITED EDITION,Rp99.000,BXS CUSTOM OFFICIAL,Tasikmalaya,1 terjual,
17SEVEN Hoodie RANDOM EXTRA DISKON,Rp60.000,17SEVEN ORIGINAL,Jakarta Timur,50+ terjual,4.7
SPRFX Hoodie Staple Deep Blue,Rp199.000,SPRFX,Kab. Malang,11 terjual,5.0
JAKET SWEATER HOODIE FULL ZIPPER BAPE SHARK WGM GLOW IN THE DARK BLACK,Rp249.000,ROUTE88STORE,Bandung,22 terjual,4.9
tali hoodie dan celana Big premium hitam,Rp10.000,monica_acsesories,Tangerang Selatan,24 terjual,4.9
Hoodie nike sportswear black grade original / sweater nike nsw premium,Rp108.900,DECLINE Official,Bandung,28 terjual,4.9
Have A Good Time Frame Logo Hoodie,Rp660.000,Emertyve,Kab. Bantul,,
KOZE - HOODIE COMFORT - Hoodie Polos,Rp189.000,KozeOfficial,Jakarta Timur,70+ terjual,4.8
Adidas Rekive Hoodie,Rp947.000,sudutpandangstore,Bandung,1 terjual,5.0
SWEPO Hoodie Zipper Dog (Bordir) Size M-XXL (Pria & Wanita),Rp91.900,SWEPO Official Store,Kab. Tangerang,250+ terjual,4.9
OCWA RJ MULTI BROWN PATCHES OVERSIZED HOODIE,Rp579.900,Ocwa Studio,Jakarta Pusat,7 terjual,5.0
HSCO Oversized Boxy Hoodie Treizy,Rp310.000,HSCO Original 13,Depok,4 terjual,5.0
isaishodo - GOJOU / JUJUTSU KAISEN / HOODIE / Outerwear / Unisex,Rp379.000,isai shodo,Kab. Bandung,70+ terjual,4.9
jaket hoodie aprilia original 100% - rare item,Rp1.099.000,scooterzone,Depok,1 terjual,5.0
Dickies Classic Logo Pull Over Hoodie Dm123-Ho01,Rp626.500,DICKIES INDONESIA,Denpasar,4 terjual,5.0
Human Greatness Hoodie Brown,Rp245.000,Human Greatness Labs,Bandung,80+ terjual,4.9
Hoodie Exclusive SR-PROJECT INDEPENDENCE DAY 79,Rp470.000,SR-PROJECT Motogarage,Kab. Bogor,13 terjual,5.0
Jaket Hoodie Sweater Anime Holo Live Ookami Mio Impression Cosplay,Rp255.000,MyHobbyTown,Kab. Tangerang,27 terjual,4.9
HSCO Hoodie Shinchan X Tahilalats Silly,Rp320.000,HSCO Original 13,Depok,90+ terjual,5.0
Jaket Pria Hoodie (BREAK) Oversize ( M-6XL ) BLACK WHITE,Rp115.000,RUMAH JUMBO,Kab. Blitar,50+ terjual,5.0
Lodybert Hoodie Polite Dark Grey,Rp220.000,Lodybert,Kab. Sukabumi,5 terjual,5.0
JAKET HOODIE POLOS BLACK BASIC,Rp190.900,Kattoen.,Malang,100+ terjual,4.9
"Hoodie SN1-022 side logo - Hitam, M",Rp598.000,Splitoff-id,Tanjung Pinang,1 terjual,
JAKET ZIPPER HOODIE POLOS BLACK BASIC,Rp200.900,Kattoen.,Malang,250+ terjual,4.9
"CHAMPION LOGO HOODIE - Hitam, S",Rp1.299.000,Badass Monkey Indonesia,Jakarta Selatan,1 terjual,
"DEUS - BUGS HOODIE - Hitam, M",Rp807.500,Deus Ex Machina Official,Denpasar,5 terjual,5.0
Jaket Parasut Windbreaker Waterproof Sablon Custom Satuan,Rp92.000,CrafTex,Jakarta Selatan,250+ terjual,4.9
jaket wanita terbaru kece/jaket wanita hangat/jaket sytle cewe,Rp140.000,sidqia_shop,Kab. Garut,30+ terjual,5.0
Gudang Wearpack - Baju Kerja Proyek Semi Jaket Dongker Tosca,Rp140.000,Gudang Wearpack Official Shop,Kab. Cilacap,40+ terjual,5.0
Jaket Sauna Suit Olahraga Baju Jas Pembakar Lemak Elastis Baju Sauna Olahraga Pembakar Lemak Hook,Rp595.000,Indofight Official,Tangerang Selatan,1 terjual,
JAKET PRIA WANITA OLAHRAGA ANTI UV MESH UV PROTECTION M-L-XL-XXL-XXXL,Rp49.900,FR_OLSHOP SPORT,Bandung,250+ terjual,4.8
