Product,Price,Seller,Location,Sold,Rating
SWEPO Hoodie Jumper 1989 (Bordir) Size M-XXL (Pria & Wanita),Rp82.900,SWEPO Official Store,Kab. Tangerang,100+ terjual,4.8
Acme De La Vie ADLV Baby Face Hoodie Black Donut 1 100% Original,Rp1.545.000,True OG Kicks,Kab. Tangerang,50+ terjual,4.9
Fear of God Essentials Nylon Fleece Hoodie Authentic,Rp3.599.000,True OG Kicks,Kab. Tangerang,1 terjual,5.0
Moxie Sweatshirt Washed Unisex Touch Black Washed Hoodie Crop,Rp199.800,Moxie Inconspiracy,Bandung,250+ terjual,4.9
House of Smith Sweater Hoodie Pria - Howave Black #5,Rp199.000,House of Smith Official,Kab. Bandung,80+ terjual,5.0
Aerostreet Hoodie Alexander Hitam Sweater Jumper CAAAA,Rp139.900,Aerostreet,Kab. Klaten,1rb+ terjual,4.9
HOOLIGANS Hoodie Deux Brand 20.1,Rp128.800,HOOLIGANS,Bandung,750+ terjual,4.9
Human Greatness Hoodie Black,Rp245.000,Human Greatness Labs,Bandung,1rb+ terjual,4.9
Bloods Sweater Hoodie Tobermory 04 Black,Rp174.500,BLOODS OFFICIAL STORE,Cimahi,250+ terjual,4.9
Insurgent Club - Hoodie Basic Boxy Black,Rp350.000,Insurgent Club,Bandung,100+ terjual,4.8
"Jaket Sweater Hoodie Zipper Resleting Polos Pria Murah Promo - Mocca, M",Rp44.900,AnR-Shop,Kab. Bandung,1rb+ terjual,4.7
"Mickout Hoodie ""Wesen"" Dark Grey",Rp109.658,Mickout Project,Bandung,19 terjual,4.9
House of Smith Sweater Hoodie Pria - Worhood #6,Rp199.000,House of Smith Official,Kab. Bandung,90+ terjual,5.0
LinkaweOriginal Jaket Hoodie Basic Pria,Rp120.000,LinkaweOriginal,Bandung,250+ terjual,4.9
House of Smith Sweater Hoodie Pria - Fujismith Blue Black,Rp170.000,House of Smith Official,Kab. Bandung,30+ terjual,5.0
Hoodie Katun SSST Crag Cagoule Hitam,Rp351.749,SSST ID,Bandung,40+ terjual,5.0
Screamous Sweater Pria Basic Pullover Zipper Hoodie Sean Black,Rp210.000,SCREAMOUS 55,Bandung,100+ terjual,4.9
Hush Puppies Jaket Hoodie Pria Ridict 4 Black,Rp349.000,Hush Puppies,Tangerang,50+ terjual,4.9
Chambredelavain X Basboi Boxy Hoodie / CHMB Zip /Basic Black/ USS 2023,Rp749.000,Compass Boew,Bandung,40+ terjual,5.0
Human Greatness Midweight Hoodie Black,Rp265.000,Human Greatness Labs,Bandung,250+ terjual,4.9
"""SPIKE"" OVERSIZED GREY HOODIE 99CLOVER",Rp549.000,99clover,Jakarta Timur,100+ terjual,4.9
Aerostreet Hoodie Zipper Hysteria Vano Hitam Sweater Jumper CCAAA,Rp169.900,Aerostreet,Kab. Klaten,500+ terjual,4.9
KATTOEN JAKET JUMPER HOODIE POLOS - DARK PURPLE,Rp190.900,Kattoen.,Malang,40+ terjual,4.9
HLPD WeirdWorld | Jaket | Sweater I Boxy Hoodie Star Grey,Rp189.000,HLPD WEIRDWORLD,Bandung,21 terjual,5.0
Insurgent Club - Hoodie Basic Boxy Washed,Rp399.200,Insurgent Club,Bandung,100+ terjual,4.9
Adidas x Fear Of God Athletics Heavy Fleece Hoodie Authentic - S,Rp4.799.000,True OG Kicks,Kab. Tangerang,2 terjual,5.0
Hoodie 0W3-187 jumbo arrow grey,Rp698.000,Splitoff-id,Tanjung Pinang,3 terjual,5.0
Men's Pullover Jacket Hoodie Mix,Rp99.000,ETC.OriginalSupply,Bekasi,90+ terjual,4.8
RRMF Official Hoodie Speed Conqueror V.2 Non Zipper Protective New Collection 2024,Rp582.000,RRMF Official,Jakarta Selatan,1 terjual,5.0
Jaket Hoodie Zipper Minecraft Printing 3D Jaket Anak Minecraft #ZIP-04,Rp99.250,Lapak Kaos 3D,Bandung,6 terjual,5.0
Larusso | Attack on Titan Hoodie Levi Ackerman,Rp179.970,LARUSSO OFFICIAL STORE,Jakarta Barat,11 terjual,5.0
HOOLIGANS Hoodie Bold Netral - Dusty Blue,Rp178.800,HOOLIGANS,Bandung,100+ terjual,5.0
Human Greatness Hoodie Olive,Rp175.000,Human Greatness Labs,Bandung,250+ terjual,4.9
Human Greatness Hoodie zipper Black,Rp285.000,Human Greatness Labs,Bandung,250+ terjual,4.9
Roughneck H012 Black Sig Black Bold Hoodie,Rp145.000,ROUGHNECK 1991 Official,Kab. Bogor,4rb+ terjual,4.8
hoodie polos hitam jumper S M L XL XXL XXXL XXXXL big size,Rp50.000,sagalapolosan,Kab. Bandung,1rb+ terjual,4.9
Hoodie Pria PUMA ESS SMALL LOGO FZ HOODIE TR 68085976 ORIGINAL,Rp385.000,Sneakers Dept,Bekasi,80+ terjual,5.0
HOOLIGANS Hoodie Play Black,Rp158.800,HOOLIGANS,Bandung,500+ terjual,4.8
Hoodie Pria Hush Puppies Munched 4 Black,Rp349.000,Hush Puppies,Tangerang,250+ terjual,4.9
Hush Puppies Jaket Hoodie Pria Ridict 4 Olive,Rp349.000,Hush Puppies,Tangerang,30+ terjual,5.0
Bodypack Rancher Hoodie Sweater - Olive,Rp509.150,BODYPACK OFFICIAL STORE,Kab. Bandung,1 terjual,5.0
Insurgent Club - Hoodie High Angel Washed,Rp399.200,Insurgent Club,Bandung,100+ terjual,4.9
Ricky Is Clown Laser Hoodie Black Original,Rp1.300.000,Oriten Store,Kab. Tangerang,8 terjual,5.0
HOODIE IMPORT BMW MOTORSPORT,Rp548.000,bimbimco,Bandung,3 terjual,5.0
BAPE 1ST CAMO SHARK FULL ZIP HOODIE YELLOW,Rp7.299.000,Badass Monkey Indonesia,Jakarta Selatan,,
Screamous Sweater Pullover Hoodie LEGEND TINY ON WHITE BLACK,Rp199.000,SCREAMOUS 55,Bandung,250+ terjual,4.9
BAJU JERSEY MANCING HOODIE,Rp55.000,cerruti,Jakarta Utara,100+ terjual,4.9
HSCO Oversized Boxy Hoodie Veida,Rp310.000,HSCO Original 13,Depok,30+ terjual,5.0
Jaket Pria Hoodie Sunmori Prostreet Ronin Rider Jepang,Rp88.350,Galeri21,Kab. Bandung,2rb+ terjual,4.8
QUADRANT Hoodie Distro Pria Polos Simple Original Tebal,Rp75.000,Quadrant Official,Kab. Bandung,250+ terjual,4.8
Insurgent Club - Hoodie Zipper Basic Boxy Black,Rp375.000,Insurgent Club,Bandung,40+ terjual,4.9
Russ Sweater Hoodie Oldskull Black,Rp199.000,Russ & Co.,Bandung,100+ terjual,4.8
JAKET ZIPPER HOODIE POLOS BLACK BASIC,Rp200.900,Kattoen.,Malang,250+ terjual,4.9
Cottonsupply Heavyweight Boxy Crop Hoodie 330 Gsm,Rp189.000,Cottonsupply,Tangerang,50+ terjual,4.8
Aerostreet Hoodie Zipper Polos Gelap Sweater Jumper PAAAA,Rp169.900,Aerostreet,Kab. Klaten,1rb+ terjual,4.9
POLO - 7696.61 Mens Hoodie - Gray,Rp229.000,POLO Indonesia Official,Jakarta Barat,23 terjual,4.9
Hush Puppies Jaket Hoodie Pria Ridict 4 Dark Gray,Rp349.000,Hush Puppies,Tangerang,70+ terjual,4.9
HODISO - Astronot Hoodie Jumper Pullover,Rp89.900,Hodiso Official,Jakarta Barat,100+ terjual,4.9
SWEPO Hoodie Zipper Talented (Bordir) Size M-XXL (Pria & Wanita),Rp91.900,SWEPO Official Store,Kab. Tangerang,80+ terjual,4.9
HOOLIGANS Hoodie Bold Brand 22.14 Sage Green,Rp198.800,HOOLIGANS,Bandung,500+ terjual,4.9
Deliwafa - Sobat Ngarit | Hoodie | Sweatshirt Jacket | Fashion Pria Wanita,Rp150.000,Deliwafa Official Store,Surabaya,50+ terjual,5.0
HSCO Oversized Boxy Hoodie Stern,Rp310.000,HSCO Original 13,Depok,10 terjual,5.0
Moxie Sweatshirt Washed Unisex Touch Black Washed Hoodie Crop,Rp199.800,Moxie Inconspiracy,Bandung,250+ terjual,4.9
THXU - Hoodie Jumper Polos Size M - XXL ( Pria & Wanita ),Rp72.999,THXU.CO,Kab. Bandung,80+ terjual,5.0
Russ Sweater Hoodie Bevy Sage,Rp199.000,Russ & Co.,Bandung,100+ terjual,4.9
AVTECH - Baselayer Kaos Manset Lengan Panjang Pria Wanita Olahraga Outdoor Hoodie Dry Fit - WANDER,Rp202.500,Avtech - Adventure Technology,Jakarta Timur,40+ terjual,5.0
HEAVY SOFT (HOODIE) YARN SPINDLE,Rp130.000,Y&S Kaos Polos,Kab. Bandung,1rb+ terjual,4.9
Russ Sweater Hoodie Amsterdam Navy Blue,Rp199.000,Russ & Co.,Bandung,80+ terjual,4.9
"HOODIE POLOS JUMBO BIGSIZE UNISEX, PRIA WANITA,SIZE,XXL-5XL.",Rp68.450,am.store.,Kab. Bandung,500+ terjual,4.9
Vitlexs Jaket hoodie cowok bahan tebal Hoodie pria distro Tebal,Rp135.000,Vitlexs Official Shop,Kab. Bandung,30+ terjual,4.9
FortKlass Jaket Zipper Polos Pria Kupluk Hoodie Unisex Pria Wanita,Rp66.561,FortKlass,Jakarta Barat,4rb+ terjual,4.7
Russ Sweater Hoodie Tinylog Black,Rp199.000,Russ & Co.,Bandung,500+ terjual,4.9
Dobujack Little Logo Dusty Pink Hoodie,Rp194.000,DOBUJACK,Bandung,50+ terjual,4.8
INSRGT - Basic Logo Small Embroided Hoodie Black,Rp359.000,Insurgent Club,Bandung,100+ terjual,4.9
Human Greatness Hoodie White,Rp245.000,Human Greatness Labs,Bandung,250+ terjual,4.9
HOOLIGANS Hoodie Bold Visione 22.1 - Black,Rp198.800,HOOLIGANS,Bandung,250+ terjual,4.9
HOODIE SWEATER JUMBO PRIA SIZE XXL - XXXL HOODIE OVERSIZE UNISEX,Rp99.999,Clothing-daily,Bandung,80+ terjual,4.8
KREMLIN Pullover Hoodie Black - MAHITO,Rp249.900,KremlinOfficial,Bandung,40+ terjual,5.0
KILIMANJARO FLASH - Base Layer hoodie - Baselayer Kilimanjaro Flash,Rp135.000,Kilimanjaro Outdoor,Jakarta Timur,250+ terjual,4.9
HOODIE ADIDAS ESSENTIALS TERRY 3-STRIPES IC0435 / 20242,Rp760.000,arkais official,Depok,5 terjual,4.7
"SWEPO Hoodie Jumper San Diego California (Bordir) Size M-XXL (Pria & Wanita) - Latte, L",Rp88.900,SWEPO Official Store,Kab. Tangerang,30+ terjual,4.9
Russ Sweater Hoodie Bevy Sage,Rp199.000,Russ & Co.,Bandung,100+ terjual,4.9
Commongoods Basic Pullover Hoodie Series,Rp209.000,Common Goods,Jakarta Barat,100+ terjual,4.8
Denim Tears - The Cotton Wreath Black Hoodie,Rp1.800.000,6SOF,Jakarta Barat,3 terjual,5.0
Hodie Jumbo Bigsize Pria Unisex Fatgoods Cotton Fleece Lennox,Rp240.000,FATGOODS,Tangerang Selatan,26 terjual,4.8
Russ Sweater Hoodie Bevy Sage,Rp199.000,Russ & Co.,Bandung,100+ terjual,4.9
BAPE 1ST CAMO SHARK FULL ZIP HOODIE GREEN,Rp7.299.000,Badass Monkey Indonesia,Jakarta Selatan,,
POLO - 7860.93 Hoodie Mens - Army Bear,Rp199.000,POLO Indonesia Official,Jakarta Barat,16 terjual,5.0
Commongoods Basic Pullover Hoodie Series,Rp209.000,Common Goods,Jakarta Barat,100+ terjual,4.8
Men's Full Zipp Fleece Hoodie,Rp274.550,ETC.OriginalSupply,Bekasi,60+ terjual,5.0
JAKET HOODIE POLOS GREY MISTY,Rp190.900,Kattoen.,Malang,90+ terjual,4.9
HOODIE ONELAB BLACK WHITE SERIES | KSR ONEONENINE,Rp375.000,Oneonenine Streetwear,Kab. Bandung Barat,40+ terjual,4.8
Jaket hoodie AQUATECH original resleting waterproof,Rp150.000,B_COLECTION,Kab. Bandung,750+ terjual,4.8
Three2nd x Basquiat Hoodie Sweater Frenchterry Empire 070723,Rp369.000,3Second Official,Bandung,9 terjual,5.0
Screamous Sweater Pria Pullover Hoodie LOGO CROWN BLACK,Rp199.000,SCREAMOUS 55,Bandung,40+ terjual,4.9
Denim Tears - The Cotton Wreath Black Hoodie,Rp1.800.000,6SOF,Jakarta Barat,3 terjual,5.0
Hodie Jumbo Bigsize Pria Unisex Fatgoods Cotton Fleece Lennox,Rp240.000,FATGOODS,Tangerang Selatan,26 terjual,4.8
Hoodie pria OENIQU by Antares authentic All Varian super jumbo,Rp90.000,Antares Store Official,Kab. Bandung,15 terjual,4.8
Hoodie Stussy All Dolls Black,Rp710.000,Gudang Bubu Official,Tangerang,5 terjual,5.0
KREMLIN Pullover Hoodie Anime - Berserker,Rp229.900,KremlinOfficial,Bandung,500+ terjual,4.9
Hoodie polos big size M-XXXL sweater polos hodie polos switer polos,Rp70.000,Dct clothing bdg,Bandung,3rb+ terjual,4.8
tali Hoodie super premium original,Rp4.000,firda accsesoris,Tangerang Selatan,50+ terjual,5.0
Roughneck HZ070 Navy Rochester Zipper Hoodie,Rp160.000,ROUGHNECK 1991 Official,Kab. Bogor,28 terjual,4.9
KOZE - HOODIE COMFORT GREY - Hoodie Polos Abu-Abu,Rp189.000,KozeOfficial,Jakarta Timur,30+ terjual,4.8
KATTOEN JAKET HOODIE POLOS - HALF ZIPPER SERIES II,Rp197.900,Kattoen.,Malang,80+ terjual,4.8
"Hoodie Elders Company ""Black Letter"" - Black",Rp346.500,Elders Company,Jakarta Selatan,30+ terjual,5.0
Hoodie Katun SSST Crag Cagoule Hoodie,Rp375.200,SSST ID,Bandung,70+ terjual,5.0
Pullover Hoodie Lengan Pendek Putih,Rp135.000,hoodie addict,Bandung,100+ terjual,4.8
Jaket hoodie pria zipper premium dengan lapis bulu tebal dan hangat,Rp90.000,Aishwa & co galeri,Kab. Garut,70+ terjual,5.0
Hoodie polos putih jumper bahan fleece ready S samapi BIGSIZE,Rp50.000,sagalapolosan,Kab. Bandung,100+ terjual,4.9
Hoodie F0G-046 reflective font white,Rp598.000,Splitoff-id,Tanjung Pinang,,
KREMLIN Tactical Pullover Hoodie Hitam - FATE,Rp249.900,KremlinOfficial,Bandung,50+ terjual,4.9
Roughneck H174 Black Sig White Hoodie,Rp145.000,ROUGHNECK 1991 Official,Kab. Bogor,1rb+ terjual,4.8
Fear Of God Essentials Hoodie Core Jet Black Authentic - XXS,Rp2.599.000,True OG Kicks,Kab. Tangerang,10 terjual,5.0
Moxie Sweatshirt Washed Unisex Crestfallent Black Washed Hoodie,Rp131.800,Moxie Inconspiracy,Bandung,90+ terjual,4.8
Double Zip Hoodie Boxy oversize Fillingstreet - Wise,Rp339.999,fillingstreet,Yogyakarta,40+ terjual,4.8
LEAF OG Logo Classic Black Hoodie,Rp190.000,LEAF Goodtimes,Depok,60+ terjual,4.7
Jaket hoodie zip up bulu hangat di musim dingin terbaru hoody zipper,Rp169.500,Aishwa & co galeri,Kab. Garut,100+ terjual,5.0
Aerostreet Hoodie Playmaker Hitam Hoodie Sweater Jumper CAAAA,Rp159.900,Aerostreet,Kab. Klaten,250+ terjual,4.9
HODISO - Baggy Hoodie Oversized Pullover Unisex,Rp81.999,Hodiso Official,Jakarta Barat,250+ terjual,4.9
JAKET HOODIE ZIPPER POLOS UNISEX,Rp55.000,POLOS.COM,Bandung,750+ terjual,4.9
Russ Sweater Hoodie Everybody Broken White,Rp199.000,Russ & Co.,Bandung,100+ terjual,4.7
Commongoods Basic Pullover Hoodie Series,Rp209.000,Common Goods,Jakarta Barat,100+ terjual,4.8
Duraking Jaket Pria Hoodie RSG Series - Ruiz,Rp238.000,Duraking Outdoor&Sports,Kab. Bandung,250+ terjual,4.9
FortKlass Hoodie Polos Premium Hoodie outerwear Kupluk Pria Unisex,Rp73.000,FortKlass,Jakarta Barat,250+ terjual,4.8
NIKE ACG HOODIE PULLOVER ORANGE,Rp499.000,Gudang TIMTAM,Surabaya,,
UNKL347 Jacket Hoodie Misty Model Simpel Bahan Fleece CVII,Rp110.000,UNKL347 Store,Kab. Karanganyar,100+ terjual,4.6
Hoodie 0W3-084 Wave diag black,Rp798.000,Splitoff-id,Tanjung Pinang,2 terjual,5.0
"No Void Minds AEZY Kanji Hoodie | Charcoal - Sand, L",Rp259.900,No Void Minds Official Store,Bandung,100+ terjual,5.0
Hoodie 0W3-105 monroe white SUPERMIRROR - S,Rp798.000,Splitoff-id,Tanjung Pinang,,
KOZE - HOODIE COMFORT BLACK - Hoodie Polos Hitam,Rp189.000,KozeOfficial,Jakarta Timur,90+ terjual,4.9
"MOA49 Hoodie Pria Premium ScubaLux Adem ""katakana rib"" hitam",Rp249.000,Third Day,Bandung,4 terjual,5.0
HOOLIGANS Hoodie Bold Netral 22.2 - Navy,Rp178.800,HOOLIGANS,Bandung,100+ terjual,5.0
Hoodie Boxy oversize Fillingstreet - WRD blackk,Rp329.999,fillingstreet,Yogyakarta,27 terjual,5.0
Santa Cruz Classic Dot Chest Hoodie SM1220501,Rp799.999,Santa Cruz Skateboards Official,Denpasar,8 terjual,5.0
Human Greatness Midweight Hoodie Beige,Rp265.000,Human Greatness Labs,Bandung,100+ terjual,4.8
Hoodie Poncho Tenun Etnik Pria Wanita RAKA,Rp188.100,awanethniccraft,Jakarta Selatan,90+ terjual,5.0
Cottonology Hoodie Pria Dany Zipper Hijau Army,Rp145.000,Cottonology Indonesia,Bandung,100+ terjual,4.9
Russ Hoodie Zipper Drake Black,Rp239.000,Russ & Co.,Bandung,80+ terjual,5.0
Greenlight Jaket Hoodie Perth Regular Fit Katun Fleece C030524,Rp319.000,3Second Official,Bandung,9 terjual,4.3
BRTWL - HOODIE BOXY OVERSIZE - MERCY,Rp269.000,watch your step yk,Kab. Bantul,50+ terjual,5.0
Hoodieku Hoodie Jumper Basic Polos Pria,Rp139.000,hoodieku official,Depok,750+ terjual,4.9
Outerwear Unisex Erigo Hoodie Polos Black,Rp239.000,Erigo Official,Kab. Tangerang,6 terjual,5.0
JAKET SWEATER HOODIE FULL ZIPPER BAPE SHARK WGM CAMO MERAH FULL TAG,Rp249.999,ROUTE88STORE,Bandung,29 terjual,4.9
FortKlass Hoodie LIFEWORK BASIC Pria Kupluk Hoodie Unisex Pria Wanita,Rp46.000,FortKlass,Jakarta Barat,30+ terjual,4.0
Troveast Zipper Hoodie Outdoor Parka Cotton Series Black,Rp199.000,Troveast Official Store,Tangerang,15 terjual,4.9
House of Smith Sweater Hoodie Pria - Howave Black #5,Rp199.000,House of Smith Official,Kab. Bandung,80+ terjual,5.0
Sipolos Sweater Hoodie Cotton Fleece 330GSM,Rp275.000,Sipolos Official Shop,Bandung,30+ terjual,4.9
Miracle Mates - Valder Black Hoodie,Rp379.050,Miracle Mates,Bandung,26 terjual,4.9
Seattle Hoodie Logo Seattle Basic / Hoodie Basic / Hoodie Jumper,Rp47.999,Seattle Pusat Kaos Polos,Kab. Tangerang,100+ terjual,4.8
Russ Sweater Hoodie Oldskull Broken White,Rp199.000,Russ & Co.,Bandung,40+ terjual,5.0
Russ x Toystory Sweater Hoodie Woody Hood 02 Broken White,Rp249.000,Russ & Co.,Bandung,12 terjual,4.9
Dobujack Little Logo Black On Black Hoodie,Rp189.000,DOBUJACK,Bandung,500+ terjual,4.8
Cottonology Hoodie Dany Zipper Black,Rp165.000,Cottonology Indonesia,Bandung,250+ terjual,4.8
tali hoodie bulat premium/tali jogger,Rp4.500,firda accsesoris,Tangerang Selatan,750+ terjual,4.9
Hoodie Lengan Pendek Short Slevee Polos Pria Wanita Exlusive,Rp65.000,Matrix Apparel,Kab. Bandung Barat,90+ terjual,4.8
JAKET PRIA ADIDAS INDIGO HERZ FUR HOODIE IJ9087 / 20231,Rp960.000,arkais official,Depok,20 terjual,5.0
Hoodieku Hoodie Zipper Basic Polos Pria,Rp157.410,hoodieku official,Depok,250+ terjual,4.9
JAKET ZIPPER HOODIE POLOS - CARBON GREY,Rp200.900,Kattoen.,Malang,70+ terjual,4.9
SWEPO Hoodie Jumper Star (Bordir) Size M-XXL (Pria & Wanita),Rp88.900,SWEPO Official Store,Kab. Tangerang,100+ terjual,4.9
Cottonsupply Crop Boxy ZIP Hoodie Heavyweight,Rp229.000,Cottonsupply,Tangerang,70+ terjual,4.8
Hoodie Eksklusif EIC Evolene,Rp95.000,gorillasupplement,Bandung,6 terjual,5.0
Straight Vision - Goat Hoodie,Rp259.000,Straight Vision,Bandung,15 terjual,4.4
Outerwear Unisex JB Hoodie Zip Bary Black,Rp229.000,Official JB Store,Kab. Banyumas,250+ terjual,4.9
Hoodie Oversize Boxy Colourspace - Arcane HD 019 Blue,Rp255.000,colourspaceofficialstore,Kab. Bantul,26 terjual,4.9
"Acme De La Vie ADLV Boucle Round Logo Hoodie Authentic - CHARCOAL, SIZE 1",Rp1.645.000,True OG Kicks,Kab. Tangerang,2 terjual,5.0
Hoodie P4-007 palmskull black - S,Rp598.000,Splitoff-id,Tanjung Pinang,1 terjual,
W.Essentiels X One Piece Type Face Zoro Oversize Hoodie Forest Green,Rp548.100,Wormhole Store,Bandung,16 terjual,5.0
Essentials FOG Core Tan Reflective Hoodie (100% Authentic),Rp1.999.000,senikersku_id,Surabaya,1 terjual,5.0
Insurgent Club - Planting Hoodie Brown,Rp359.000,Insurgent Club,Bandung,29 terjual,5.0
hoodie UA under armour embroidered logo original sale,Rp425.000,fllsogood,Jakarta Utara,1 terjual,5.0
KREMLIN Pullover Hoodie Black HD - Oya Gakusei,Rp550.000,KremlinOfficial,Bandung,1rb+ terjual,4.9
Insurgent Club - Hoodie College Series White Black,Rp350.000,Insurgent Club,Bandung,250+ terjual,4.9
Hoodie 0W3-018 caravaggio lute black SUPERMIRROR - XS,Rp798.000,Splitoff-id,Tanjung Pinang,1 terjual,
Hoodie Nasa / Jaket Astronot / Nasa Space X sweater,Rp190.000,z4h Cloth,Jakarta Timur,5 terjual,5.0
tali hoodie premium 8mm flat aglet,Rp5.000,Rumah produksi Tali,Tangerang Selatan,1rb+ terjual,4.9
THXU - Hoodie Jumper THXU V2 Size M - XXL ( Pria & Wanita ),Rp75.799,THXU.CO,Kab. Bandung,50+ terjual,4.9
Human Greatness Midweight Hoodie Dark Grey,Rp265.000,Human Greatness Labs,Bandung,100+ terjual,5.0
Cottonology Hoodie Zipper Dany Black,Rp165.000,Cottonology Indonesia,Bandung,100+ terjual,4.8
Human Greatness Hoodie Dark Grey,Rp245.000,Human Greatness Labs,Bandung,100+ terjual,5.0
Hoodie C0D'-033 ripped relaxed font black - S,Rp598.000,Splitoff-id,Tanjung Pinang,1 terjual,5.0
KREMLIN Mecha Pullover Hoodie Mocca - DAMAGE,Rp249.900,KremlinOfficial,Bandung,500+ terjual,4.9
Hoodie L5'-331 side logo black mono,Rp598.000,Splitoff-id,Tanjung Pinang,2 terjual,5.0
KREMLIN Varsity Hoodie Jacket - Revenge,Rp399.900,KremlinOfficial,Bandung,100+ terjual,4.9
INSRGT - Basic Logo Small Embroided Hoodie Black,Rp359.000,Insurgent Club,Bandung,100+ terjual,4.9
KREMLIN Pullover Hoodie Black HD - Oya Gakusei,Rp550.000,KremlinOfficial,Bandung,1rb+ terjual,4.9
Wormhole Jaket Billing Cycle Hoodie Black,Rp439.000,Wormhole Store,Bandung,40+ terjual,4.8
Human Greatness Hoodie Misty M71,Rp245.000,Human Greatness Labs,Bandung,250+ terjual,4.9
Insurgent Club - Roots Hoodie Black,Rp359.000,Insurgent Club,Bandung,60+ terjual,4.8
Oversized Hoodie Black,Rp199.000,Cottonsupply,Tangerang,250+ terjual,4.9
Aerostreet Hoodie Aero Paint Hitam Sweater Jumper CAAAA,Rp159.900,Aerostreet,Kab. Klaten,100+ terjual,4.9
Jaket Sweater Anime Jujutsu Kaisen Hoodie Premium,Rp92.500,LGM shop,Bandung,1rb+ terjual,4.8
Common Goods Basic Pullover Hoodie - Black,Rp185.000,Common Goods,Jakarta Barat,250+ terjual,4.9
Hoodie Boxy Oversize Gloomie Sunday Dark grey Unisex,Rp139.000,Gloomie Sunday Apparel,Tasikmalaya,100+ terjual,5.0
Duraking Sweater Hoodie Elastica Series - Conor Hoodie,Rp156.000,Duraking Outdoor&Sports,Kab. Bandung,250+ terjual,4.9
Hoodie 0W3-059 carav frans  - S,Rp798.000,Splitoff-id,Tanjung Pinang,,
W.Essentiels x One Piece Gear 5 Luffy Oversize Hoodie Noir Black,Rp610.000,Wormhole Store,Bandung,7 terjual,5.0
Hoodie 6V-126 x chito all over print,Rp598.000,Splitoff-id,Tanjung Pinang,1 terjual,5.0
Tali hoodie embose champions,Rp15.000,Yoyo_Store5,Tangerang,3 terjual,5.0
Breakside Hoodie Blacken - Black,Rp199.000,Breakside,Kab. Bandung,100+ terjual,4.9
Hoodie Motor Prostreet Wanderer,Rp450.000,PROSTREET,Bandung,27 terjual,5.0
Hoodie Boxy Oversize Gloomie Sunday Hitam Unisex,Rp139.000,Gloomie Sunday Apparel,Tasikmalaya,100+ terjual,4.9
Insurgent Club - Hoodie High Angel Washed,Rp399.200,Insurgent Club,Bandung,100+ terjual,4.9
Marvel Collection M231 Hoodie Marvel Deadpool Nerdin 2574,Rp199.000,M231 Official Store,Kab. Tangerang,24 terjual,4.9
Hoodie Zooltrak | Ikuzo.studio | Frieren,Rp239.000,ikuzostudio,Bandung,22 terjual,5.0
Numerus Advanced Raptor hoodie / jacket / tactical / tech / sweater,Rp349.000,Numerus,Tangerang Selatan,250+ terjual,4.9
Double Zip Hoodie Boxy oversize Fillingstreet - Pst Black,Rp339.999,fillingstreet,Yogyakarta,17 terjual,5.0
Pullover Hoodie Lengan Pendek Hitam,Rp135.000,hoodie addict,Bandung,100+ terjual,4.9
Aerostreet Hoodie Oversize Polos Gelap Unisex Jumper KA2AA,Rp139.900,Aerostreet,Kab. Klaten,250+ terjual,4.9
HOODIE JUMPER PREMIUM POLOS SIZE S - XL,Rp171.000,Cievnoid,Jakarta Barat,100+ terjual,4.9
Troy Company Hoodie Boxy Oversize Black Wave White HB 2546,Rp171.900,Troy Company Official,Kab. Sleman,3 terjual,5.0
DIO Hoodie Fitted Silhouette Zipped Sig Reversible Unisex Multicolor,Rp5.250.000,Damen Herren Official,Jakarta Utara,16 terjual,5.0
Hoodie F0G-047 reflective font BLACK,Rp598.000,Splitoff-id,Tanjung Pinang,1 terjual,
tali hoodie hitam,Rp2.000,Yoyo_Store5,Tangerang,250+ terjual,4.9
Stussy World Tour Ash Heather Hoodie (100% Authentic),Rp1.399.000,senikersku_id,Jakarta Selatan,,
Reclays Hoodie Doze Hoodie Peach,Rp129.000,Reclays Official Shop,Bandung,50+ terjual,5.0
ANIMOUS HOODIE HEAVY WEIGHT BOXY FIT 375 GSM,Rp299.000,Animous Official,Bandung,3 terjual,5.0
Insurgent Club - Hoodie College Series White Black,Rp350.000,Insurgent Club,Bandung,250+ terjual,4.9
Aerostreet Hoodie Street Art Hitam Sweater Jumper CAAAA,Rp159.900,Aerostreet,Kab. Klaten,250+ terjual,4.9
Erigo Hoodie Zipper Basic Black Unisex,Rp254.000,Erigo Official,Kab. Tangerang,19 terjual,5.0
Jaket Hoodie Redbull Racing Team F1 Red Bull Season 2021 2022,Rp234.900,warung kia bandung,Bandung,40+ terjual,4.8
KIZARU Hoodie Sweater Little Logo BLACK,Rp129.900,Kizaru World,Bandung,90+ terjual,4.9
Jaket Hoodie Solo Leveling Jubah Sung Jinwoo Cosplay Anime Black,Rp205.000,MyHobbyTown,Kab. Tangerang,70+ terjual,5.0
NRDN Clothing Sweater HOODIE AMOR,Rp199.000,Nrdn Official,Jakarta Utara,8 terjual,5.0
SWEATER HOODIE ESSENTIALS WASHING DARK GREY PREMIUM AUTHENTIC FULL TAG,Rp169.999,ROUTE88STORE,Bandung,100+ terjual,4.8
Marvel Collection M231 Marvel D100 Logo Hoodie Biru 3022,Rp199.000,M231 Official Store,Kab. Tangerang,70+ terjual,4.9
MILLS Batman Jaket Olahraga Hoodie Jacket Black 31009DC,Rp324.350,MILLS Official,Kab. Tangerang,8 terjual,4.8
3Second x RRQ Jaket Hoodie Zipper Its Time To Be A King C031023,Rp356.850,3Second Official,Bandung,5 terjual,5.0
Wellborn Howler Hoodie Black,Rp272.300,wellborn official shop,Bandung,18 terjual,5.0
KATTOEN JAKET HOODIE POLOS - HALF ZIPPER SERIES,Rp187.900,Kattoen.,Malang,100+ terjual,4.8
House of Smith Sweater Hoodie Pria - Honof Black,Rp199.000,House of Smith Official,Kab. Bandung,40+ terjual,4.9
Gozeal | Hoodie Boxy | Drain,Rp300.000,Gozeal Official Store,Serang,40+ terjual,4.9
JAKET HOODIE POLOS BLACK BASIC,Rp190.900,Kattoen.,Malang,100+ terjual,4.9
Jaket Hoodie Airism Resleting UV protection UNIQLO ORIGINAL TERMURAH,Rp447.000,Jastip Sameday,Jakarta Barat,100+ terjual,5.0
Russ Sweater Hoodie Favela Broken White,Rp209.000,Russ & Co.,Bandung,100+ terjual,4.8
JAKET COWOK PARASUT PRIA WATERPROOF HOODIE ANTI AIR OUTDOOR PARASIT,Rp132.500,Halo Jaket OfficialStore,Kab. Bandung,250+ terjual,4.9
Soulfifteen Hoodie League Hoodie - Black Outer Pria,Rp189.000,Soulfifteen Official Shop,Bandung,20 terjual,4.9
Tali Hoodie flat aglet/Hoodie/tali switer besi,Rp2.000,Arba'a Ex,Tangerang,10rb+ terjual,4.9
Jaket Polos New States Apparel 9500 Super Blend Hoodie,Rp140.000,New States Apparel,Jakarta Barat,1rb+ terjual,4.9
Oversized Boxy Hoodie Brown,Rp199.000,Cottonsupply,Tangerang,100+ terjual,4.9
VESPA HOODIE GREY,Rp785.700,Vespa,Jakarta Timur,40+ terjual,5.0
Jaket Polos Pria Wanita Jaket Hoodie Pria Sweater Hoodie Polos Unisex,Rp115.000,EVERNEXT OFFICIAL,Tangerang,750+ terjual,4.9
JAKET ADIDAS GRAPHICS HACK THE ELITE HOODIE FUZI IC5739 / 20231,Rp960.000,arkais official,Depok,3 terjual,5.0
Hoodie ADIDAS TRAIN ICONS 3-STRIPES TRAINING HOODIE HS7513 / 20232,Rp770.000,arkais official,Depok,1 terjual,
Levi's Men's New Original Zip-Up Hoodie (34584-0016),Rp799.900,Levi's Official,Tangerang,7 terjual,5.0
Bigarmour Banda - Base Layer Hoodie,Rp189.000,BIGARMOUR INDONESIA,Bekasi,100+ terjual,4.9
Aerostreet Hoodie Earth Angel Hitam Sweater Jumper CADAA,Rp159.900,Aerostreet,Kab. Klaten,250+ terjual,4.9
hoodie lengan pendek fllece tebal,Rp59.000,nailclot,Kab. Bandung Barat,60+ terjual,4.8
HOOLIGANS Hoodie Bold Netral Sage Green,Rp178.800,HOOLIGANS,Bandung,21 terjual,5.0
jaket sweater pria kerah tinggi tanpa hoodie,Rp62.000,nailclot,Kab. Bandung Barat,500+ terjual,4.9
hoodie nike SB original sale,Rp849.000,fllsogood,Jakarta Utara,,
W.Essentiels Jacket Label Bleu Affinity Ref-7311 Hoodie Mink Grey - 1,Rp599.000,Wormhole Store,Bandung,3 terjual,
tali Hoodie lebar 2 cm,Rp5.000,Yoyo_Store5,Tangerang,100+ terjual,4.9
KREMLIN Cybernetic Pullover Hoodie - Crimson,Rp229.900,KremlinOfficial,Bandung,500+ terjual,4.9
tali Hoodie premium bulat,Rp4.500,Yoyo_Store5,Tangerang,30+ terjual,5.0
sweater hoodie Pria Original Koozo,Rp64.190,KOOZO Official Shop,Kab. Bandung,750+ terjual,4.9
tali Hoodie aglet plastik full black,Rp3.500,Yoyo_Store5,Tangerang,30+ terjual,4.8
Breakside Hoodie Blacknight - Black,Rp199.000,Breakside,Kab. Bandung,250+ terjual,4.9
tali switer/tali Hoodie/tali celana,Rp4.500,Yoyo_Store5,Tangerang,1rb+ terjual,4.9
Breakside Hoodie Good Vibes - Black Hoodie Pria,Rp220.000,Breakside,Kab. Bandung,4 terjual,4.5
Gozeal | Hoodie Boxy Double Zipper | Forever,Rp300.000,Gozeal Official Store,Serang,15 terjual,5.0
