Product,Price,Seller,Location,Sold,Rating
TONIQUE Hoodie Pria Hitam COBAIN,Rp189.000,TONIQUE OFFICIAL,Bandung,3 terjual,5.0
"JAKET VARSITY HOODIE PRIA JUMBO, INISIAL E SIZE S-XXXXXXL, DUA WARNA - MERAH-HITAM, S",Rp135.000,Bigy Official,Kab. Blitar,4 terjual,5.0
Adidas Treefoil Big logo Hoodie [BLACK],Rp100.000,Clobbermadness,Cimahi,,
ZIPPER HOODIE ROOTS ORIGINAL,Rp73.000,USE2BEY0URS,Surabaya,,
NF / Sweater Hoodie Polos Dewasa / Bahan Baby terry,Rp24.800,nosinfashion,Jakarta Barat,100+ terjual,4.8
hoodie stussy original,Rp450.000,iamlalaofficial,Jakarta Timur,,
Heretic - Zip-up Zipper Hoodie - Play Your Gloomy,Rp339.000,Heretic Store,Bandung,4 terjual,5.0
"MILLS Jaket Olahraga MK Sembrani Hoodie 1.0 31007MK - BLACK, XL",Rp291.850,MILLS Official,Kab. Tangerang,1 terjual,5.0
Hoodie F0G-044 reflective font pinky,Rp598.000,Splitoff-id,Tanjung Pinang,,
House of Smith Sweater Hoodie Pria - Driftwood Hoodie,Rp139.000,House of Smith Official,Kab. Bandung,17 terjual,4.9
Hoodie P4-002 collge font grey - S,Rp598.000,Splitoff-id,Tanjung Pinang,,
Tali hoodie h&m,Rp3.000,Yoyo_Store5,Tangerang,60+ terjual,5.0
Thrasher Roses Hoodie,Rp325.000,VintagetoVogue,Jakarta Timur,,
HOODIE COKLAT LENGAN PENDEK (GU),Rp58.500,DIAR_SECONDKIDS,Kab. Mojokerto,,
HOODIE ZIPPER KUALITAS DISTRO BAHAN BABY TERRY MEREK MONKL BLANK,Rp138.000,GrosirPakaianPria,Bandung,1 terjual,5.0
Hecates Hoodie Drop 19,Rp550.000,Shaipreloved,Surabaya,,
jaket hoodie custom + design gambar/tulisan,Rp150.000,Pasar Sablon,Jakarta Barat,500+ terjual,4.7
"Hoodie 1HN-001 mummy  - Putih, S",Rp598.000,Splitoff-id,Tanjung Pinang,2 terjual,5.0
Common Goods Basic Pullover Hoodie - Sepia Brown - XL,Rp209.000,Common Goods,Jakarta Barat,40+ terjual,4.8
Hoodie BP-004 intermiami white - M,Rp598.000,Splitoff-id,Tanjung Pinang,1 terjual,5.0
"LinkaweOriginal Jumper Hoodie Kombinasi Pria - Hitam/Marun, M",Rp180.000,LinkaweOriginal,Bandung,,
COSMIC Pullover Hoodie Alright Misty,Rp210.000,COSMICCLOTHES,Bandung,250+ terjual,4.7
Hoodie zipper Hard Rock Cafe Las Vegas Original,Rp1.799.000,'ROCKETS',Bandung,,
Kaos Hoodie Lengan Pendek Deus Fleece Casual Unisex,Rp98.000,Kittie Sweetie,Kab. Bandung,7 terjual,4.8
Jaket Hoodie Under Armour The Rock Projects Original,Rp1.200.000,MR Sport,Kab. Bogor,,
Fear Of God Essentials - Hoodie - SS21,Rp850.000,6SOF,Jakarta Barat,1 terjual,
JAKET HOODIE PULLOVER GENSHIN XIAO Ready S-6XL Pria Wanita ALLSIZE,Rp145.500,WV_Jaket.Official,Kab. Blitar,1 terjual,5.0
KIZARU Hoodie Sweater Little Logo GREEN BOTTLE,Rp129.900,Kizaru World,Bandung,40+ terjual,5.0
Jaket Sweater Hoodie Ninja Polos,Rp90.000,DOUBLE.ONE.,Cimahi,1 terjual,5.0
Tali hoodie / Celana 8mm,Rp9.000,Agung Shope 69,Surabaya,7 terjual,5.0
Muji Jaket Hoodie French Terry Pullover Hoodie (XS-L) Original,Rp150.000,Branded ADS,Jakarta Barat,3 terjual,5.0
JAKET AKPOL JAKET HOODIE AKPOL JAKET AKADEMI KEPOLISIAN JAKET POLISI J,Rp160.000,sailormoon_ols,Kab. Semarang,1 terjual,4.0
hoodie rusty ori,Rp180.000,Lewis Bastian Shop,Kab. Bandung,,
Pullover Hoodie UNIQLO X JMB original,Rp400.000,Badmarket,Kab. Bogor,,
HOODIE Zipper Aprilia Racing Ixon Motorcycle Jaket Big Size XS-5XL,Rp165.000,HSCLO,Kab. Blitar,1 terjual,
JAKET ANIME ATTACK ON TITAN BROWN CANVAS HOODIE,Rp245.000,Hidari Shop,Kab. Bantul,100+ terjual,4.3
Black Boxyfit Hoodie Heavyweight Cotton 375gsm No Design ( V4 ),Rp349.900,onlyifyouknow_,Kab. Sidoarjo,18 terjual,5.0
Supreme Color Blocked Zip Hoodie - Black 100% Original,Rp3.999.000,Sneakers4play,Tangerang,,
hoodie nike sb original,Rp459.000,Just Hobbies,Jakarta Selatan,,
"Bape Shark Hoodie Fullzip Yellow camo, Space Camo, GITD",Rp3.500.000,Savagemarket.id,Kab. Sleman,,
hoodie,Rp40.000,Al-Iqbal,Kab. Bogor,,
Champion Japan Domestic Market Small Logo C Zip Hoodie - Navy,Rp379.000,hoyweapstore,Jakarta Barat,6 terjual,4.8
Jaket Hoodie WEC 2024 Team Toyota Gazoo Racing TGR Fullprint,Rp200.000,DISTRONGER_OFFICIAL,Semarang,2 terjual,5.0
hoodie pria dewasa import preloved-Hitam polos,Rp69.900,keenarstore99,Surakarta,,
[Jaket hoodie polos]Jaket hoodie cowok | Jaket hoodie,Rp125.231,EndRock Store,Denpasar,70+ terjual,4.9
hoodie polos hijau fuji/hoodie jumper/bahan katun fleece,Rp74.900,FLOUXY STORE,Jakarta Barat,14 terjual,4.7
hoodie anti social social club original canceled edition rare item,Rp750.000,Kreathrifty,Jakarta Selatan,,
"Hoodie Pria, Hoodie Wanita H&M Toy Story",Rp100.000,RIOTBrand,Jakarta Timur,250+ terjual,4.9
W.Essentiels Le Petit Oversize Hoodie Pink,Rp599.000,Wormhole Store,Bandung,,
Vtg Tommy Hilfiger collour block hidden Hoodie jacket,Rp1.800.000,sevenstar2nd,Bandung,,
Unik Jaket Hoodie Sweater ALPINESTAR YOMERCH01 Diskon,Rp250.400,"giantika, store",Jakarta Barat,,
Hoodie Off White X Looney Tunes,Rp1.400.000,NL STORE 016,Kab. Bekasi,2 terjual,5.0
Kemeja Cprduroy Hoodie,Rp285.000,Lappa Official,Jakarta Selatan,7 terjual,5.0
Hoodie Off White Tape Arrow White,Rp1.100.000,HypeTurnal,Jakarta Utara,1 terjual,5.0
Spitfire - Lil Beatdowns Hoodie Black,Rp975.000,Motion Skateshop,Kab. Badung,,
hoodie ellese gotero misty,Rp150.000,wadidaw_os,Cimahi,,
Lonsdale Hoodie (Navy/White) Original,Rp450.000,Brit80sclub,Jakarta Pusat,7 terjual,5.0
POISON FOREVER SANCTUARY HOODIE BLACK,Rp375.000,Poison Stockroom,Bandung,2 terjual,5.0
ZIPPER HOODIE DC DARK GREY PRELOVED,Rp85.000,kirasecondstuff,Kab. Tangerang,,
Jaket Hoodie zipper Guns N Roses,Rp165.000,Pasar Sablon,Jakarta Barat,5 terjual,5.0
Sweater Hoodie Spongebob Squarepants Nickelodeon Driver Bikini Bottom,Rp175.000,KPOP ADDICT,Jakarta Barat,6 terjual,5.0
Tali hoodie dan celana rubber Import,Rp5.000,Accesoriesqu,Tangerang Selatan,7 terjual,5.0
"Sweater Hoodie Pocket Bordir Samping  Pria Distro Bandung Brand Jico - Kupluk Hitam, M",Rp83.453,JICO CLOTHING,Kab. Bandung,,
"jaket sweater hoodie pria Tomoinc Made of Bones Mr Buzz - Hitam, S",Rp350.000,Tomoinc Store,Jakarta Timur,,
Switer Hoodie Jumper Original Limited Edition By OCYD 4,Rp149.000,OCYD,Cimahi,7 terjual,5.0
HOODIE PRIA TOMOINC METALLIKEA WHITE,Rp350.000,Tomoinc Store,Jakarta Timur,,
Hoodie Pria Pullover NSA Front Logo Cloud Green-HPRSPACE,Rp179.000,Authentic wearhouse,Bekasi,,
Breakside Hoodie Queens - White - XL,Rp199.000,Breakside,Kab. Bandung,40+ terjual,4.7
HOODIE EGR PRI JUMBO/ HOODIE OVERSIZE S M L XL XXL XXXL 4XL 5XL,Rp120.000,Pradast,Kab. Blitar,2rb+ terjual,5.0
Breakside Hoodie Blackout - Black - XXL,Rp199.000,Breakside,Kab. Bandung,8 terjual,4.7
Rown Division Jaket Hoodie Polos Parsons Misty - L,Rp169.000,Rown Division Store,Surakarta,40+ terjual,4.9
Escaperfect Hoodie Simple Type Dvsn misty - XXL,Rp190.000,Escaperfect,Kab. Bandung,10 terjual,4.8
Hoodie jumper polos,Rp55.000,Juragan Online Jakarta,Jakarta Selatan,21 terjual,4.7
hoodie vetements (good kondisi),Rp450.000,watercat_thrif,Jakarta Timur,,
Roughneck HZ043 Off White 1991 Line Zipper Hoodie,Rp190.000,ROUGHNECK 1991 Official,Kab. Bogor,18 terjual,5.0
Geoff Max - Colation Pullover Navy  | Jacket | Hoodie | Sweatshirt | Mantel,Rp244.000,Geoff Max Official,Bandung,3 terjual,5.0
SWEATER HOODIE ORIGINAL PREVILLE SHERPA AURHENTIC FULL TAG & LABEL,Rp299.999,ROUTE88STORE,Bandung,1 terjual,4.0
"Jaket Sweater Hoodie Pria Original KOOZO dengan 5 varian Warna - Hitam, L",Rp93.590,KOOZO Official Shop,Kab. Bandung,5 terjual,5.0
"Moxie Jaket Pullover Gorpcore Shelter Hitam Black Jacket - HItam, XL",Rp199.800,Moxie Inconspiracy,Bandung,100+ terjual,4.8
HOODIE HITAM ITB PRESS X FOLK BDG,Rp299.000,ITB Press,Bandung,,
House of Smith Sweater Hoodie Boxy Pria - Flock Black Boxy Heavyweight,Rp375.000,House of Smith Official,Kab. Bandung,1 terjual,
"SWEATER HOODIE UKURAN JUMBO BIG SIZE XXL - XXXL ZEBRA CROSS-PUTIH - XXL, GOODTIMES BLACK",Rp95.000,Antares Store Official,Kab. Bandung,4 terjual,5.0
Udloff Hoodie Boxy Blue Pure Love Oversize Unisex,Rp149.900,UDLOFFICIAL,Bandung,8 terjual,4.7
BAJU KAOS HOODIE PRIA LENGAN PENDEK / LONGLINE HOODIE OS DARK GREY,Rp159.000,TARKANAL ID,Kab. Bandung Barat,1 terjual,
hoodie champion original Lilac,Rp70.555,thrifting26mei,Jakarta Selatan,,
CDG Comme des garcons - hoodie,Rp700.000,koleksifff,Depok,,
House of Smith Sweater Hoodie Pria - Hoslime Black #5,Rp225.000,House of Smith Official,Kab. Bandung,30+ terjual,4.9
Hoodie coach men signature,Rp2.000.000,Brand Surf Shop,Kab. Bandung,,
Rompi Hoodie Direktorat Jenderal Bina Marga,Rp335.000,Auroramiguela,Bekasi,3 terjual,5.0
Jaket Hoodie Korea Pria List Four Original Sensor Premium Waterproof,Rp156.900,Baak Store,Bandung,11 terjual,4.8
Undefeated Zip Lock Hoodie White Original,Rp740.000,Oriten Store,Palembang,,
Hoodie Second Thrifting Full Brand VOL 2,Rp353.000,kenzie2024,Bandung,,
"MILLS Jaket Olahraga MK Sembrani Hoodie 1.0 31007MK - BLACK, XL",Rp291.850,MILLS Official,Kab. Tangerang,1 terjual,5.0
Hoodie Jaket Hitam IKN Indonesia Nusantara Ibu Kota Baru Outwear - M,Rp150.000,Gem Sablon,Jakarta Pusat,6 terjual,5.0
"New States Apparel ( NSA ) JAKET Hoodie Polos 9500 Import Original - BLACK, S",Rp160.000,Grosir clo,Jakarta Selatan,1rb+ terjual,4.9
"tali hoodie premium impor aglet. tali jaket premium ujung besi kapsul  - Hitam, 150 cm",Rp5.983,Arba'a Ex,Tangerang,30+ terjual,5.0
"Jaket Katun Pria Cowok Bolak balik Motor Impor Fashion Murah Adem - Cokelat, M",Rp200.000,DERIA SHOP,Jakarta Pusat,100+ terjual,4.9
Hoodie Thrasher Original Green,Rp250.000,melepaskenangan,Malang,,
Sweater Hoodie Pria Original Koozo Logo / jaket Pria terbaru Koozo,Rp64.190,KOOZO Official Shop,Kab. Bandung,70+ terjual,4.8
Outerwear Hoodie Zade Supply The Devil Black,Rp175.000,RWKNDINC,Bandung,,
Jaket Hoodie Zipper MotoGP Mandalika Circuit Indonesia Lombok,Rp165.000,Pasar Sablon,Jakarta Barat,1 terjual,
Zipper Hoodie WKND WJM.6.438 - NAVY,Rp315.000,wkndclothes,Bandung,3 terjual,5.0
BULLS SYNDICATE Hoodie Weiverp Black,Rp450.000,Bulls Syndicate,Surakarta,1 terjual,
Jaket Hoodie Minecraft Youtuber streamer Dream,Rp150.000,Triple Six,Jakarta Barat,2 terjual,5.0
Jaket Sweater Hoodie Pria - wanita Original Janets,Rp65.500,KOOZO Official Shop,Kab. Bandung,20 terjual,4.8
TRIPLE Hoodie Unisex Reguler Fit (YHD 008 OLV) - Olive,Rp363.930,Triple Jeans Official,Surabaya,2 terjual,5.0
Vintage MOONEYES Moon Eyes Size fit 69x55cm - Navy Hoodie Pre Loved,Rp650.000,KONKUBIN PASAR SANTA,Jakarta Selatan,,
"Supreme Color Blocked Jaket Zip Up Hoodie - Royal 100% Original - BLACK, M",Rp3.725.000,True OG Kicks,Kab. Tangerang,2 terjual,5.0
"HOODIE ADIDAS CLASSIC | JUMPER ADIDAS | SWEATER ADIDAS GRADE ORIGINAL - Hitam, M",Rp169.000,BATTLE STORE91,Kab. Bandung Barat,1 terjual,
"Hoodie 6S1'-077 interlocking g logo - Hitam, S",Rp698.000,Splitoff-id,Tanjung Pinang,,
House of Smith Sweater Hoodie Pria - Blues Blue Black Blue - L,Rp99.000,House of Smith Official,Kab. Bandung,6 terjual,5.0
"Hoodie 6S1'-100 clasic logo motif black - Hitam, S",Rp598.000,Splitoff-id,Tanjung Pinang,,
Black ID - Sweater Hoodie Lengan Panjang Pria Full Katun Hitam | HD Barnes,Rp275.000,Black ID Official Shop,Kab. Bandung,1 terjual,5.0
HOODIE SUPREME BOX LOGO CLASSIC,Rp885.000,kedaibranded.co,Tarakan,,
Rucas TAILOR D Rise of Textured Art Painting Hoodie and Shorts 100% Original,Rp500.000,Berrlanco,Jakarta Timur,,
Zip Hoodie Brand Un1qlo Second,Rp95.000,onethrift_in,Malang,,
Hoodie Wtaps WTVUA second,Rp360.000,Ode Second,Kab. Buton,,
Sweater Hoodie Pria WESTERNER Switer Distro Lokal Brand Premium,Rp160.000,ONEQLO,Kab. Bandung,26 terjual,4.8
jaket Hoodie pria dewasa prostreet naga terbaru Hoodie prostreet murah,Rp80.000,Dct clothing bdg,Bandung,4 terjual,5.0
JAKET HOODIE EVOSTRIPE Core FZ Hoodie Puma Black 585812 01,Rp1.039.200,ADF OUTLET TANGERANG,Kab. Tangerang,4 terjual,5.0
Jaket Sweater Hoodie NASA DISCOVERY high quality,Rp150.000,BAROKAH DISTRO,Jakarta Timur,100+ terjual,4.9
hoodie hush puppies original size S grey,Rp150.000,sneakers vans14,Kab. Bekasi,,
Hoodie Pullover Premium - Custom Design - MeowCotton,Rp349.000,MeowCotton,Jakarta Barat,5 terjual,5.0
Pullover Hoodie Jesus Surrender,Rp250.000,Made In Mars,Jakarta Pusat,,
Hoodie band Official Linkin Park 2005,Rp300.000,Yogashara,Jakarta Utara,,
Aerostreet Hoodie Alexander Hijau Sweater Jumper CBAAA,Rp159.900,Aerostreet,Kab. Klaten,100+ terjual,4.9
hoodie aape original,Rp875.000,Korakora_Lama,Kab. Minahasa,,
JAKET SWEATER ASSC x UNDEFEATED PARANOID HOODIE BLACK ORANGE ORIGINAL,Rp1.500.000,Hypebeastyle,Jakarta Selatan,6 terjual,4.5
hoodie jeep ori,Rp80.000,nindysshop,Kab. Kendal,,
Hoodie Mighty Power ranger Hijau,Rp250.000,Jefuku,Kab. Cilacap,,
Techwear Punk Pocket Buckles Hoodie Mens Hooded Loose Pullover St,Rp1.435.200,Amaze Gallery2,Kab. Bandung,,
HOODIE ESTABILISHED WASH BLACK PAPERSMOOTH,Rp425.000,Papersmooth Official,Kab. Bandung,1 terjual,5.0
JAKET HOODIE RESMOB/SWITER HOODIE RESMOB/,Rp132.000,Kaos Sultan Mah Bebas,Kab. Bandung Barat,2 terjual,4.5
CATHARSIS REBORN WRAITH HOODIE,Rp666.000,Local Rare Item,Kab. Cilacap,2 terjual,
Jaket Hoodie Parasut Cressida The Next Level JB069Y - Navy,Rp351.920,Cressida The Next Level,Bandung,4 terjual,5.0
Karl Lagerfeld Paris Men Colorblock Hoodie,Rp699.000,labelsforless,Jakarta Pusat,2 terjual,
Jaket Hoodie Kali Linux Root User,Rp149.000,hMira,Kab. Bantul,1 terjual,
JAKET HOODIE POLOS ZIPPER BIRU MUDA PRIA WANITA L XL XXL CHOMAZ,Rp55.000,CHOMAZ OFFICIAL SHOP,Bandung,40+ terjual,5.0
bape hoodie original,Rp3.000.000,WTS stock,Surabaya,,
Hoodie Ralph Lauren Kuning,Rp130.000,Hitamputihsec,Surabaya,,
Hoodie Pria Polos / Jaket Hoodie Sweater Pria / Hoodie Pria Keren,Rp56.000,JnJStreetWear,Semarang,10 terjual,5.0
(100% AUTHENTIC) CHAMBREDELAVAIN BOXY HOODIE BLESSED WHITE SERIES,Rp1.199.900,MAMAS YUDHI OFFICIAL STORE,Jakarta Timur,1 terjual,5.0
HOODIE BORDIR DESCENTE HITAM ORI MURAH,Rp100.000,Toko_Doaibu1,Kab. Sidoarjo,,
Hoodie nike center swoosh navy original NETT,Rp500.000,vintagetree's_apples,Jakarta Timur,,
Off White x Champion Hoodie Black 100% Original Authentic,Rp3.200.000,luxury_beast,Bandung,,
Hoodie Pullover Angels and Airwaves - Blurred Profile Official Merch,Rp900.000,Rotten Merch ID,Bekasi,,
JAKET KULIT HOODIE GGP,Rp600.000,Asgarito,Jakarta Pusat,,
Sweater Hoodie Jumper Hitam Black - M,Rp59.900,DD Gallery,Jakarta Pusat,1rb+ terjual,4.8
JAKET HOODIE ADIDAS CLASSIC GRADE ORIGINAL - SWEATER - klasik hitam,Rp167.310,DECLINE Official,Bandung,100+ terjual,4.8
JAKET HOODIE POLOS BLACK BASIC,Rp190.900,Kattoen.,Malang,100+ terjual,4.9
"Hoodie SN1-022 side logo - Hitam, M",Rp598.000,Splitoff-id,Tanjung Pinang,1 terjual,
JAKET ZIPPER HOODIE POLOS BLACK BASIC,Rp200.900,Kattoen.,Malang,250+ terjual,4.9
HOODIE PRIA PRINTED ANTHRAX LOGO - S,Rp349.000,Tomoinc Store,Jakarta Timur,1 terjual,5.0
Hoodie The Beatles - Logo White Square,Rp250.000,The Good Vibes Inc,Bekasi,1 terjual,1.0
HOODIE TOMOINC DUA LIPA NEON EDGES - S,Rp350.000,Tomoinc Store,Jakarta Timur,,
Dobujack Sweater Little Logo Abstract Black Crewneck,Rp166.000,DOBUJACK,Bandung,250+ terjual,4.9
Fashion Pria Outerwear Hoodie Tomoinc Weezer - Kermit - S,Rp350.000,Tomoinc Store,Jakarta Timur,,
Hoodie Tehbotol Sosro X Damn! I Love Indonesia - Straight Outta Bottle,Rp190.000,Sosro Official Store,Bekasi,11 terjual,5.0
hoodie R234 full set,Rp900.000,cloud id store,Kab. Magelang,,
Sprayground Crumpled Hoodie Black,Rp3.000.000,Voila.ID,Jakarta Selatan,,
ratfink zipp hoodie no mooneyes claysmith,Rp500.000,LOAX BASTARD,Bandung,,
Lacoste x Mastermind World Hoodie Black XL,Rp6.700.000,Streettrends,Jakarta Barat,,
"Jaket Sweater New States Apparel Original NSA Crewneck 9000 - S - XXL - ROYAL BLUE, XXL",Rp130.000,Moteza Indonesia,Jakarta Pusat,100+ terjual,4.9
HOODIE PRIA PRINTED BLACK SABBATH LOGO PURPLE - S,Rp349.000,Tomoinc Store,Jakarta Timur,1 terjual,
Jaket Eiger Michigan Hoodie (910004775),Rp529.000,Anes Shopp,Depok,70+ terjual,4.9
Pullover Hoodie Twotone Hitam x Putih,Rp137.500,hoodie addict,Bandung,70+ terjual,4.9
Cottonology Hoodie Pria Zipper Biru Mint,Rp145.000,Cottonology Indonesia,Bandung,29 terjual,4.8
"Flanel Hoodie Unisex M,L,XL",Rp85.000,Kemeja Bandung Store,Bandung,60+ terjual,4.3
Hodie New Era Original,Rp245.000,Janissary_Diecast&Toys,Bekasi,,
hoodie zipper zara man,Rp80.000,Aghnia Store Magelang,Magelang,,
Terlaris Jaket Hoodie Sweater Nike SB AWD,Rp185.000,AlWahid Store,Jakarta Timur,1 terjual,
HODISO - Rabbits Hoodie Jumper Pullover,Rp89.900,Hodiso Official,Jakarta Barat,15 terjual,5.0
SWEATER HOODIE NAPAPIJRI OUTDOOR FULL ZIPPER.,Rp250.000,Ririe_branded,Tangerang,4 terjual,5.0
Calle De Larache CDL Hoodie/Knitwear/Tshirt/Pants - ORIGINAL,Rp315.000,Thirtyone_store,Jakarta Timur,5 terjual,5.0
hoodie adidas mohamad ali,Rp150.000,wadidaw_os,Cimahi,,
Bloods Series Sweater Hoodie Timetrue Black,Rp240.000,BLOODS OFFICIAL STORE,Cimahi,12 terjual,4.9
Official Merch Taylor Swift Grey Eras Tour Hoodie,Rp2.343.250,PS Enterprise Official,Jakarta Utara,,
Sun Protection Clothing Uniqlo Models Outdoors Anti UV Jacket Hoodie,Rp63.000,AfaShop_Collection,Kab. Bandung,20 terjual,4.8
"RUCAS ""Ultra Stich"" Leather Bone hoodie",Rp450.000,RUCAS TNG,Tangerang,,
LEAF OG Logo Tie Dye Black Hoodie,Rp190.000,LEAF Goodtimes,Depok,17 terjual,5.0
Sweater Rajut Pria Gomuda Hoodie Full Zip - Black,Rp270.000,Gomuda,Cimahi,500+ terjual,5.0
JAKET GOGGLE HOODIE KACAMATA/JAKET KEKINIAN 4varia wrn,Rp182.000,Qualityshopp,Kab. Bandung,5 terjual,5.0
Unsettled Hoodie Tokyo Ghoul Kaneki Black Anime Ghoul,Rp300.000,METRO ANIME STORE,Medan,27 terjual,4.8
Jaket Sweater Hoodie RELIGI TAUHID Black Zipper Fleece Premium L XL,Rp89.000,ALMYRA22STORE,Bandung,1 terjual,
MATSUDA Sweater Hoodie Inazawa,Rp159.000,Matsuda Apparel,Jakarta Utara,90+ terjual,4.9
Actual Visual Guidance Hoodie Navy,Rp1.459.000,Wormhole Store,Bandung,2 terjual,5.0
Outerwear Unisex JB Hoodie Bary Navy,Rp199.000,Official JB Store,Kab. Banyumas,100+ terjual,4.9
"[ORIGINAL] TELEPATI CHE X SLOWANDLY HOODIE ""HRTLYP"" TSHIRT TEE ""KISSLV"" LIMITED EDITION",Rp519.000,navyblue.,Bekasi,,
adidas rompi Hoodie Champ Utility,Rp499.000,Heritage Brand,Tanjung Pinang,2 terjual,5.0
jaket hoodie nike original,Rp1.250.000,Kardo.ID,Bekasi,,
JAKET HOODIE FRIDAY KILLER | STRING WHITE HOODIE,Rp241.500,FRIDAY KILLER CO,Kab. Pamekasan,,
JAKET LION PARCEL - HOODIE LION PARCEL - JAKET KURIR LION PARCEL,Rp80.000,foronestyle,Jakarta Timur,13 terjual,5.0
SWEATER HODIE PRAGMATIC IINDONESIA GAME SLOT PLAY,Rp137.000,RKC CLOTH,Kab. Bandung,,
PLC-1967-Polo Jaket Pria-Kuda Kecil/Polo Hoodie 2575,Rp191.000,joline.olshop,Jakarta Barat,2 terjual,5.0
Supreme - Box Logo (Bogo) Hoodie Fw17 - Ice Blue,Rp2.250.000,YNC Shop,Cimahi,8 terjual,5.0
Sweater Hoodie Anime Solo Leveling Mini Igris Shadow,Rp99.000,Custom baju,Jakarta Barat,1 terjual,5.0
Kaos hoodie motif loreng malpinas,Rp33.500,Toko  Grosir Online,Bandung,100+ terjual,5.0
HOODIE PRIA PUMA x BUTTER GOODS Hoodie Spellbound 534057 84,Rp599.700,PUMA OUTLET KARAWANG,Kab. Karawang,,
Jaket Hoodie Pria Wanita Racing Line 201 Meter Division,Rp55.000,MINOIDE,Depok,,
Nike White Zipper Hoodie Sports,Rp185.000,Thrifting_skuyy,Tasikmalaya,,
JACKET HOODIE FRIDAY KILLER | DIPPY SERVA HOODIE,Rp316.000,FRIDAY KILLER CO,Kab. Pamekasan,,
Hoodie Jumper Camo Army Blue - Jaket Original Export Quality Murah,Rp219.900,The Gino Store,Jakarta Selatan,10 terjual,4.7
Hoodie Deus Palugada,Rp1.000.000,Apa Lu Cari Gua Ada,Surabaya,30+ terjual,5.0
Kaos Hoodie MBA original lengan pendek Unisex,Rp70.356,Almos_Distro,Bandung,6 terjual,5.0
Dobujack Logo Font Green Hoodie,Rp189.000,DOBUJACK,Bandung,40+ terjual,5.0
Russ Sweater Hoodie Eternal Roots Misty,Rp199.000,Russ & Co.,Bandung,30+ terjual,4.8
JAKET HOODIE BIGSIZE JUMBO HIGHEST - HJH15,Rp335.000,highestworld,Semarang,8 terjual,5.0
jaket hoodie bershka bekas,Rp120.000,extyo store,Bekasi,,
UNKL347 Jacket Hoodie Hitam Model Simpel Bahan Fleece ARKA,Rp110.000,UNKL347 Store,Kab. Karanganyar,10 terjual,4.8
Bape color camo Hoodie navy,Rp175.000,Bintang877,Makassar,,
hoodie hugo bosss,Rp2.950.000,luxbrand99,Tanjung Pinang,,
Hoodie Superdry,Rp100.000,Second_S,Kab. Bogor,,
hoodie off white,Rp135.000,Urey12,Kab. Tasikmalaya,,
HODISO - HDSO Authentic Hoodie Jumper Pullover,Rp89.900,Hodiso Official,Jakarta Barat,4 terjual,5.0
Boxy Zip Hoodie Chambredelavain - Masking Tape BK Original,Rp999.999,CIOSTORE.ID,Kab. Bekasi,1 terjual,
M231 Sweater Hoodie Grafis Coklat 2090B,Rp109.000,M231 Official Store,Kab. Tangerang,5 terjual,5.0
DEVA STATES HOODIE,Rp250.000,Landscape Market,Bandung,,
ZIP HOODIE UNIQLO SERPA SECOND THRIFT,Rp50.000,alfi thrift store,Medan,,
JAKET TRACKER JUVENTUS HITAM RONAL HOODIE UNISEX PRIA CASUAL HIKING XL,Rp105.900,jaket fashionmart,Kab. Bogor,4 terjual,4.5
"jaket pria hoodie premium desain berkelas waterproof k7h99 - Black Eye, L",Rp199.000,Kopi 7 Huruf,Jakarta Barat,9 terjual,5.0
SWEPO Hoodie Jumper 1989 (Bordir) Size M-XXL (Pria & Wanita),Rp82.900,SWEPO Official Store,Kab. Tangerang,100+ terjual,4.8
Acme De La Vie ADLV Baby Face Hoodie Black Donut 1 100% Original,Rp1.545.000,True OG Kicks,Kab. Tangerang,50+ terjual,4.9
Moxie Sweatshirt Washed Unisex Touch Black Washed Hoodie Crop,Rp199.800,Moxie Inconspiracy,Bandung,250+ terjual,4.9
Fear of God Essentials Nylon Fleece Hoodie Authentic,Rp3.599.000,True OG Kicks,Kab. Tangerang,1 terjual,5.0
HOODIE BAND PUNK SEX PISTOLS SWEATER JAKET PRIA WANITA DISTRO TEBAL,Rp99.999,Fuzz Supply,Kab. Bogor,3 terjual,5.0
Jaket HOODIE VEST Komunitas Satudarah MC Motor Club Big Size XS-5XL,Rp165.000,HSCLO,Kab. Blitar,1 terjual,5.0
Casual Hoodie Zipper Full Mesh RNW Rabbit And Wheels Hoodie,Rp1.849.900,Asunakku Japan,Kab. Bandung Barat,,
EA7 (Emporio Armani) Logo Core Identity Hoodie Black Gold,Rp3.000.000,Voila.ID,Jakarta Selatan,,
JAKET BOMBER HOODIE PRIA WANITA THREELINE,Rp99.999,threelineshop,Kab. Bandung,40+ terjual,
"jaket semi kulit pria  jaket motor bikers touring casual tbb292 - Putih Hitam, M",Rp250.000,The Big Boss 17,Jakarta Utara,,
"baju kaos pria full print t-shirt casual premium - Hitam, M",Rp75.000,Kopi 7 Huruf,Jakarta Barat,19 terjual,4.0
"baju kaos pria shirt lengan panjang casual fashion tbb257 - Maroon, M/L",Rp120.000,The Big Boss 17,Jakarta Utara,,
"kaos pria premium baju kerah pria casual k7h22 - Hitam, L",Rp99.000,Kopi 7 Huruf,Jakarta Barat,28 terjual,4.2
"baju shirt kaos polos pria lengan pendek model terbaru resleting tbb87 - Hijau Tosca, M/L",Rp120.000,The Big Boss 17,Jakarta Utara,11 terjual,4.8
Kale HUDSON - Hoodie Pria - Sweater Pria -  Sweater Hoodie,Rp325.000,Kale Clothing,Bandung,5 terjual,5.0
Hoodie Keyakizaka46 The Last Live 2020 Size XL,Rp350.000,OSHITORE OFFICIAL,Malang,,
Animous Jaket Hoodie Goaway,Rp225.000,Animous Official,Bandung,40+ terjual,5.0
Tracksuit Trackpant Hoodie Palace 1set size L,Rp2.000.000,lvxsstore,Kab. Kediri,,
hoodie levis second,Rp400.000,yang tau bae lah,Palembang,,
hoodie palace zodiac,Rp670.000,4U.CATALOG_,Kab. Bekasi,,
AVENGERS Endgame Quantum Realm Hoodie by Artlantis Store,Rp200.000,uniqverz,Tangerang Selatan,30+ terjual,4.2
Hoodie Stussy Center Fashion Bordir Red ( Size M ),Rp200.000,styleshop13,Jakarta Timur,,
W.Essentiels Ecume Monopack Oversize Hoodie Blue Cerulean Crayola,Rp503.100,Wormhole Store,Bandung,5 terjual,5.0
Jaket Hoodie Cotton Fleece Programmer Komposisi H122,Rp155.000,Romi Robert Store,Kab. Bogor,18 terjual,4.6
House of Smith Sweater Hoodie Pria - Howave Black #5,Rp199.000,House of Smith Official,Kab. Bandung,80+ terjual,5.0
"baju shirt kaos polos pria lengan pendek model terbaru resleting tbb88 - Hijau Tosca, M/L",Rp120.000,The Big Boss 17,Jakarta Utara,10 terjual,4.0
"Jaket Sweater Hoodie Zipper Resleting Polos Pria Murah Promo - Mocca, M",Rp44.900,AnR-Shop,Kab. Bandung,1rb+ terjual,4.7
"Outer Hoodie Unisex No Void Minds AEZY Signature Charcoal - Smoke, M",Rp259.900,No Void Minds Official Store,Bandung,250+ terjual,5.0
Jaket Hoodie Zipper Minecraft Printing 3D Jaket Anak Minecraft #ZIP-04,Rp99.250,Lapak Kaos 3D,Bandung,6 terjual,5.0
OFF WHITE DIAG SPLIT LOGO SLIM HOODIE BLACK RED,Rp6.399.000,Badass Monkey Indonesia,Jakarta Selatan,,
Full zip hoodie diadora original,Rp175.000,Just Hobbies,Jakarta Selatan,,
Roughneck H205 Black Sig Stoner Hoodie,Rp175.000,ROUGHNECK 1991 Official,Kab. Bogor,250+ terjual,4.8
Zip Hoodie Giordano Sherpa,Rp55.000,FDJR,Tangerang,,
Hoodie CALM MIND MONSTER CREAM BLUE SKY HOODIE 100% ORI,Rp1.500.000,HYPESNEAKER.ID,Semarang,,
Hoodie Mastermind x ASSC,Rp8.500.000,549store,Tanjung Pinang,,
Liverpool x NB hoodie,Rp1.800.000,Hobby Palace,Jakarta Selatan,,
Hoodie big size hoodie jumbo mix warna 6XL 5XL 4XL 3XL 2XL XL L M S,Rp148.000,Bramasta_Store,Kab. Blitar,30+ terjual,5.0
Aerostreet Hoodie Worthy Abu Muda Sweater Jumper CBAAA,Rp159.900,Aerostreet,Kab. Klaten,50+ terjual,5.0
Hoodie List Casual Trendy Ready Size M - 5XL [COD & FREE ONGKIR],Rp50.000,Shakiel Jaket & Hoodie,Kab. Bandung,100+ terjual,5.0
Tagged - Despair Oversized Dispatch Hoodie,Rp389.000,Tagged Official,Jakarta Barat,100+ terjual,4.9
SWEPO Hoodie Jumper San Diego California (Bordir) Size M-XXL (Pria & Wanita),Rp88.900,SWEPO Official Store,Kab. Tangerang,30+ terjual,4.9
"Mickout Hoodie ""Wesen"" Dark Grey",Rp109.658,Mickout Project,Bandung,19 terjual,4.9
House of Smith Sweater Hoodie Pria - Fujismith Blue Black,Rp170.000,House of Smith Official,Kab. Bandung,30+ terjual,5.0
Hoodie 0W3-187 jumbo arrow grey,Rp698.000,Splitoff-id,Tanjung Pinang,3 terjual,5.0
HOODIE GOODIE Zipper Dusty Green,Rp125.370,Hoodie Goodie,Bandung,90+ terjual,4.9
Oversized Boxy Hoodie Silver Grey - Full Cotton Fleece 280gsm,Rp245.000,Heyplain Official Store,Jakarta Barat,1 terjual,5.0
jaket hoodie zh sherpa uniqlo secon originl,Rp80.000,jalan-ninjaku-thrift-home,Kab. Wonosobo,,
Jaket Hoodie Kancing Polos Navy Kombinasi cream Pria Wanita Tebal - 2C,Rp105.000,Bigy Official,Kab. Blitar,4 terjual,5.0
W.Essentiels Jaket Ecume Oversize Hoodie Noir Black Essentiels,Rp559.000,Wormhole Store,Bandung,100+ terjual,4.9
Oversized Streewear Unsettled Hoodie,Rp300.000,Kudou Animanga,Medan,9 terjual,4.6
Hoodie Putih OFF size XXL fit XL,Rp212.500,TokoBagas2nd,Jakarta Barat,,
JACKET PRIA NIKE WAVEN HOODIE BLACK ORIGINAL AUTHENTIC,Rp555.000,jarsport tokoku,Jakarta Selatan,3 terjual,5.0
Jaket Jumbo Anime Sweater Anime Chainsaw Man Denji Hoodie Premium,Rp89.300,LGM shop,Bandung,40+ terjual,4.9
