Product,Price,Seller,Location,Sold,Rating
"Off White SS19 Summer Hoodie - Black 100% Original - Hitam, XXS",Rp2.820.000,True OG Kicks,Kab. Tangerang,8 terjual,5.0
sweater hoodie camouflage loreng pull & bear,Rp150.000,hobbyshop,Medan,,
Hoodie Team arogan addicted Limited edition,Rp450.000,ANIV SHOP,Tangerang Selatan,3 terjual,5.0
Sweater Hoodie BAPE SHARK WGM CAMO EMBROID GLOW IN DARK FULL ZIPPER,Rp185.000,Liaelkids,Kab. Bandung Barat,15 terjual,5.0
HOODIE H&M NASA TIE DYE AUTHENTIC PREMIUM FULL TAG & LABEL UNISEX HIGH,Rp165.000,ROUTE88STORE,Bandung,11 terjual,5.0
Rown Division Jaket Hoodie Polos Parsons Black,Rp169.000,Rown Division Store,Surakarta,60+ terjual,4.8
HOODIE GOZI SIGNATURE BY ALWI ASSEGAF AKATSUKI,Rp195.000,GOZI BY ALWI ASSEGAF,Jakarta Selatan,6 terjual,5.0
SWEATER HOODIE PANCOAT DUCK FULL BORDIR PREMIUM AUTHENTIC FULL TAG,Rp159.999,ROUTE88STORE,Bandung,8 terjual,4.5
Jumper Hoodie Pria Muscle Fit Jumper Kombinasi,Rp59.900,Muscle Fit,Surabaya,,
Vearst Pullover Hoodie Lexo Black,Rp300.300,Vearst Official Shop,Bandung,5 terjual,5.0
Sweater Hoodie Polos Distro Pria Wanita Bahan Tebal Fleece 280 gsm,Rp72.123,bandung.id 34,Kab. Bandung,60+ terjual,4.8
(PROMO) Jaket Polos Sweater Hoodie Zipper Polos Hitam Unisex,Rp60.000,Rumah Baselayer,Bandung,750+ terjual,4.7
"SWEPO Hoodie Jumper End 90's (Sablon) Size M-XXL (Pria & Wanita) - Hitam, M",Rp94.900,SWEPO Official Store,Kab. Tangerang,10 terjual,4.7
Off White Marker Arrows Jaket Hoodie Black Red 100% Original - XS,Rp5.050.000,True OG Kicks,Kab. Tangerang,10 terjual,5.0
Russ Sweater Hoodie Oldskull Black,Rp199.000,Russ & Co.,Bandung,100+ terjual,4.8
KIZARU Hoodie Sweater Little Logo BLACK - M,Rp129.900,Kizaru World,Bandung,90+ terjual,4.9
Paper Rex Basic White Hoodie I Hoodie Putih,Rp695.000,PAPER REX OFFICIAL,Jakarta Utara,28 terjual,5.0
ASSC Anti Social Social Club Hot Wheels ASSC Hoodie,Rp7.500.000,Goodstuffjkt,Jakarta Barat,4 terjual,5.0
Sweatshirt Adidas Hoodie,Rp428.310,TZAMARA CORNER,Kab. Tangerang,,
Rhude Hoodie Mountain Logo Washed,Rp1.460.000,s3canggu,Kab. Badung,,
Jaket hoodie evolene original,Rp75.000,original.suplemen,Medan,4 terjual,5.0
Sweater Hoodie Eiger Night Sparkle 1.0 Art. 6738,Rp499.000,EAS Online,Tangerang,2 terjual,5.0
Hoodie uniqlo softshell warna biru,Rp125.000,depok_secondbrand,Kab. Klaten,,
hoodie pria lengan panjang,Rp77.910,NS Collection Official,Bandung,3 terjual,4.7
jaket hoodie zipper nerby second korea,Rp50.000,jalan-ninjaku-thrift-home,Kab. Wonosobo,,
jaket sweater Hoodie nii,Rp85.000,hollanhop,Jakarta Barat,,
House of Smith Sweater Hoodie Pria - Blackie Army,Rp199.000,House of Smith Official,Kab. Bandung,11 terjual,4.8
Insurgent Club - Hoodie Insanity Black,Rp359.000,Insurgent Club,Bandung,5 terjual,5.0
Human Greatness Hoodie zipper Red,Rp285.000,Human Greatness Labs,Bandung,26 terjual,5.0
Hoodie Pria Oakley (Ori indo),Rp260.000,MTFKR store,Kab. Klaten,,
kaos proyek kerja Hoodie / bertopi lengan panjang basahan sawah tani,Rp17.900,zanethaofficial,Kab. Demak,1rb+ terjual,4.8
MEDELLIN Hoodie Polos Pria Lengan Panjang 101184 HITAM,Rp110.000,Medellin Store,Jakarta Barat,,
Sweater Hoodie STUSSY Ace Premium Authentic Full Tag & Label Unisex,Rp159.999,ROUTE88STORE,Bandung,3 terjual,5.0
jaket hoodie zipper pria big size xxxl xxxxl 5xl 6xl 7xl 8xl,Rp279.000,BIG JORDAN,Kab. Bandung,12 terjual,5.0
Sweater Rajut Hoodie Tebal Full Zipper Cotton,Rp190.000,Dzicloth,Bandung,13 terjual,5.0
SWEATER HUSPUR HOODIE,Rp385.000,HUSTED YOUTH OFFICIAL,Bandung,,
Zipper Hoodie Burgerkill Adamantine,Rp199.900,Indielable,Bandung,17 terjual,5.0
Dobujack Suffer Black Hoodie,Rp189.000,DOBUJACK,Bandung,90+ terjual,4.9
Hoodie Sweater Pria Distro Band Lamb Of God - Hoodie Long Time,Rp99.000,nicos merch,Bandung,2 terjual,5.0
Jaket Hoodie Zipper Programmer eat sleep code repeat buku coding,Rp155.000,Romi Robert Store,Kab. Bogor,6 terjual,5.0
Hoodie WTAPS fashion second,Rp130.000,@BABESHOP,Tangerang,,
ADIDAS PERFO SCRIPT GRAPHIC TEE HOODIE THREE STRIPES LOGO - BLACK ADIC,Rp799.000,Adidas Combat Sports,Jakarta Pusat,3 terjual,
jaket sweater hoodie pria uniqlo,Rp125.000,adzkiyaStoree,Kab. Tangerang,1 terjual,5.0
SWEATER PRIA/SWEATER HOODIE/JAKET HOODIE/OUTERWEAR PRIA/FASHION PRIA,Rp6.000,KING EMBLEM BORDIR,Bandung,4 terjual,5.0
Hoodie Grey Oxford University,Rp79.000,GarasiSekenMks,Makassar,,
wtaps hoodie,Rp799.000,Etherused,Kab. Sleman,,
tali Hoodie round black ujung super,Rp4.000,Arba'a Ex,Tangerang,250+ terjual,4.9
Heretic x Vlaar - Zip-up Hoodie - FVKOF,Rp375.000,Heretic Store,Bandung,4 terjual,5.0
Official Merch YUMMY X SAVRESIN Hoodie & TEE,Rp575.000,exgrod,Surabaya,2 terjual,5.0
JAKET FRIDAY KILLER | SKULLY #2 HOODIE,Rp207.000,FRIDAY KILLER CO,Kab. Pamekasan,,
Hoodie Goodfellow Pullover Wine Maroon Original,Rp349.990,manlyofficialbranded,Kab. Tangerang,2 terjual,5.0
Bloods Sweater Hoodie Sketon Black,Rp184.500,BLOODS OFFICIAL STORE,Cimahi,80+ terjual,4.8
JAKET HOODIE PRIA WANITA KEREN BIG SIZE DISTRO HITAM KOMBINASI PUTIH,Rp165.000,CV JAKET MURAH,Kab. Blitar,19 terjual,4.5
House of Smith Sweater Hoodie Pria - Hoslime Black #5 - XL,Rp225.000,House of Smith Official,Kab. Bandung,30+ terjual,4.9
JAKET HOODIE PRIA WANITA KEREN BIG SIZE DISTRO HITAM KOMBINASI KUNING,Rp165.000,CV JAKET MURAH,Kab. Blitar,15 terjual,4.8
"Roughneck H318 Black Mini Sig White Hoodie - l, hitam",Rp175.000,ROUGHNECK 1991 Official,Kab. Bogor,1rb+ terjual,4.7
Rapha + Palace EF Hoodie Black / Genderless Jacket Men Women Sweater - S,Rp3.350.000,JacksonTokopedia,Jakarta Barat,,
TONIQUE Hoodie Pria Hitam COBAIN,Rp189.000,TONIQUE OFFICIAL,Bandung,3 terjual,5.0
"JAKET VARSITY HOODIE PRIA JUMBO, INISIAL E SIZE S-XXXXXXL, DUA WARNA - MERAH-HITAM, S",Rp135.000,Bigy Official,Kab. Blitar,4 terjual,5.0
SWEATER HOODIE JUMPER UNISEX | BLACK | ORI BY HAENHA | ONE PIECE | 1,Rp236.500,Haenha Official Shop,Jakarta Barat,,4.9
Cosmic Sweater Hoodie Tyler Black - M,Rp220.000,COSMICCLOTHES,Bandung,5 terjual,3.3
HOODIE KILLUA ZOLDYCK HUNTER X HUNTER GON SWEATER JAKET ANIME DJA,Rp86.000,DJA Cloth Official Store,Kab. Tangerang,250+ terjual,4.8
3Second x Muklay Oversize Hoodie 160323,Rp299.500,3Second Official,Bandung,4 terjual,5.0
Roughneck H450 Black Two Tone Sig Black Hoodie,Rp140.000,ROUGHNECK 1991 Official,Kab. Bogor,100+ terjual,4.7
17SEVEN Sweater Hoodie Jumper HD-0177-AMR-YLW,Rp109.000,17SEVEN ORIGINAL,Jakarta Timur,22 terjual,4.7
Dobujack Little Logo White Dusty Pink Hoodie,Rp194.000,DOBUJACK,Bandung,10 terjual,4.4
SUJI Oversized Hoodie Polos Hageru Hitam Black,Rp219.000,SUJI LAB,Kab. Bandung Barat,6 terjual,4.3
CABA 69 Hoodie Hitam Hoodie Cotton Asli Fleece Hoodie Motor Hoodie Pria,Rp195.000,CABA,Bandung,,
Hoodie Polos Pria Wanita Hitam Putih Bahan Fleece Cotton Size M-XL,Rp190.000,DEFAULT-322,Kab. Bandung,100+ terjual,4.8
"Pullover Hoodie Fleece Jaket Pria - Pinnacle Black, L",Rp329.000,ETC.OriginalSupply,Bekasi,14 terjual,5.0
Jaket Hoodie Premium CAMOE Original desain Classic Black Exclusive,Rp175.000,Importir Polyflex,Jakarta Barat,13 terjual,4.8
Black ID - Hoodie Zipper Pria Lengan Panjang Hitam | Zipp Earth,Rp259.000,Black ID Official Shop,Kab. Bandung,1 terjual,5.0
Broguy Jaket Hoodie Zipper Pria Wanita Unisex Size M-XXL Black,Rp199.000,BROGUYID,Kab. Kuningan,60+ terjual,4.9
Shining Bright For Use Pullover Hoodie - Black,Rp189.800,shiningbrightco,Depok,,
Jaket Hoodie F1 Formula One Team Terbaru 2024 Full Printing,Rp244.900,Customhade Apparel,Cimahi,4 terjual,5.0
Telepati Hoodie Kiss Me Black,Rp849.000,Loucal,Tangerang,,
hoodie,Rp37.000,malemjemuah,Kab. Blitar,,
HOOLIGANS Hoodie Bold Scott Dusty Blue,Rp218.800,HOOLIGANS,Bandung,11 terjual,5.0
LGS - Jaket Pria - 2 Side - Hitam Merah - Model Hoodie Zipper,Rp659.850,LGS Generation,Jakarta Barat,5 terjual,5.0
SWEATER HOODIE CHICAGO BULLS BLACK BORDIR AUTHENTIC FULL TAG & LABEL,Rp159.999,ROUTE88STORE,Bandung,30+ terjual,4.9
HOOLIGANS Hoodie Bold THIN Handsome 22.14 - Sage Green,Rp198.800,HOOLIGANS,Bandung,50+ terjual,5.0
"PLCLXVII - Hoodie Pria - Hoodie Lengan Pendek Logo Kecil 1505 - Hitam, XL",Rp190.800,PLCLXVII OFFICIAL SHOP,Jakarta Barat,11 terjual,4.6
HITAM Fleece PE Jaket Hoodie Jumper Polos Pria dan Wanita UNISEX,Rp65.000,Polos Pedia,Jakarta Selatan,1 terjual,
"Jaket Sweater Hoodie Polos Original - NSA Zip Hooded 9600 - CAMO - S, BLACK CAMO",Rp190.000,Moteza Indonesia,Jakarta Pusat,100+ terjual,4.9
"SWEPO Hoodie Jumper California USA (Bordir) Size M-XXL (Pria & Wanita) - Hitam, L",Rp88.900,SWEPO Official Store,Kab. Tangerang,24 terjual,4.5
"LinkaweOriginal Jumper Hoodie List hitam Pria - Abu misty muda, M",Rp180.000,LinkaweOriginal,Bandung,9 terjual,4.9
Hoodie Zipper SR-PROJECT CASUAL RIDER V2,Rp470.000,SR-PROJECT Motogarage,Kab. Bogor,3 terjual,5.0
HOODIE BIG SIZE BIG ORET / MERAH PUTIH,Rp349.000,BIG ORET,Bekasi,11 terjual,5.0
Seattle - Hoodie Sad Series Lucu Kekinian / Hoodie Sad / Hoodie Jumper,Rp47.999,Seattle Pusat Kaos Polos,Kab. Tangerang,9 terjual,5.0
hoodie columbia,Rp120.000,Fufu Thrift Store,Jakarta Barat,,
Hoodie Oversized Vl*ne X Palmmm Angelsss Purple Classic,Rp460.000,XJB STORE,Tangerang,1 terjual,5.0
Sweater Hoodie LIFEWORK Big Radog Premium Authentic Full Tag & Label,Rp159.999,ROUTE88STORE,Bandung,4 terjual,5.0
Spa*co Hoodie Martini Racing -,Rp2.200.000,Kimkom Garage,Jakarta Selatan,,
HOODIE ADIDAS ZNE WOVEN|JAKET ADIDAS ZNE FULL ZIPP|JUMPER PRIA WANITA,Rp163.350,DECLINE Official,Bandung,100+ terjual,4.7
Steigen Zipper Hoodie Fleece Grey Misty,Rp140.000,Steigen official,Bandung,5 terjual,5.0
hoodie prostreet black edition new,Rp126.000,ulum fashion,Kab. Garut,1rb+ terjual,4.8
TENDENCIES Sweater Initial Ten Hoods Black,Rp192.000,Tendencies,Jakarta Selatan,50+ terjual,5.0
"Hoodie hodie jaket sweater allied kim gimyung webtoon anime - Hitam, XS",Rp130.500,OBY MERCH,Kab. Bandung Barat,1 terjual,5.0
"LinkaweOriginal Jumper Hoodie Kombinasi Pria - Hitam/Marun, M",Rp180.000,LinkaweOriginal,Bandung,,
"No Void Minds AEZY Core xHoodie | Charcoal - Oatmeal, XL",Rp249.900,No Void Minds Official Store,Bandung,80+ terjual,5.0
W.Essentiels X One Piece Kaido Work Jacket Black,Rp1.149.000,Wormhole Store,Bandung,10 terjual,5.0
QUADRANT Hoodie Distro Pria Simple Tebal Polos Flash,Rp75.000,Quadrant Official,Kab. Bandung,5 terjual,5.0
Hoodie Boxy oversize Fillingstreet - Reality Bearing sea,Rp329.999,fillingstreet,Yogyakarta,20 terjual,4.9
"SKM - Hoodie ""Japanese Logo""",Rp180.000,SKM | Shikat Miring Official,Bandung,40+ terjual,4.8
Jaket hoodie pria Ninja zx25R kawasaki,Rp175.000,hareudang clothing,Kab. Bandung Barat,21 terjual,5.0
KAOS LENGAN PANJANG HOODIE,Rp35.200,Loens.ID,Kab. Bekasi,17 terjual,4.9
Kaza Indonesia - Hoodie Storm Tiedye,Rp199.000,kazaindonesia,Denpasar,7 terjual,5.0
BRING ME THE HORIZON - LOST (Back Print) UNISEX PULLOVER HOODIE,Rp854.050,Rockinline!,Sukabumi,,
Otsky Jaket Hoodie Flacee Polos,Rp144.900,Otsky_Official,Bandar Lampung,17 terjual,4.7
Owners Pu Hoodie - Guard,Rp135.000,owners worldwide,Bandung,19 terjual,4.9
Epidemic Pullover Hoodie 330 Gsm Washing Wishful,Rp296.250,EpidemicStreetwear,Bandung,8 terjual,5.0
FEAR OF GOD ESSENTIALS HOODIE FW23 JET BLACK 100% Authentic,Rp2.850.000,DHYPE ID,Jakarta Utara,,
Hoodie Exclusive SR-PROJECT Speedline Black Edition,Rp445.000,TOKO HELM BOGOR,Kab. Bogor,9 terjual,5.0
JAKET SWEATER HOODIE FULL ZIP BAPE SHARK WGM RAINBOW PREMIUM AUTHENTIC,Rp249.999,ROUTE88STORE,Bandung,4 terjual,5.0
frog hoodie polos unisex sweater kodok,Rp320.000,GOLDLUCK.nsr STORE,Semarang,24 terjual,4.8
Hoodie Pria Gamalama Arei Outdoorgear,Rp349.000,OFFICIAL AREIOUTDOORGEAR,Kab. Bandung,3 terjual,5.0
Jaket Hoodie Pria Rip Curl Original Wetsuit Icon Hood Navy,Rp1.299.000,Yanthisurfshop,Kab. Badung,,
Adidas zne jaket hoodie Original,Rp1.500.000,klixstore,Tangerang,5 terjual,5.0
HOOLIGANS Hoodie Bold VAR IDN - Black,Rp198.800,HOOLIGANS,Bandung,27 terjual,5.0
Shining Bright Last Stock Sale Hoodie,Rp400.000,shiningbrightco,Depok,20 terjual,4.7
Epidemic Pullover Hoodie 330 Gsm Riots Start Here,Rp296.250,EpidemicStreetwear,Bandung,1 terjual,5.0
VANE COLLECTION ZIPPER HOODIE,Rp699.000,HWHB STORE,Surabaya,,
HOODIE Sweater THE UNIVERSITY OF MELBOURNE Fleece Switer,Rp125.000,Barang Custom,Bekasi,6 terjual,5.0
Gallery Dept Long Beach Grey Hoodie,Rp1.250.000,UNCONVENTIONAL,Pontianak,1 terjual,5.0
Hoodie ANYA FORGER SPY X FAMILY Anime Jepang Terbaru Pria Wanita,Rp105.000,LecSablonDigital,Jakarta Barat,4 terjual,5.0
GILDAN HOODIE ZIP,Rp164.000,kaos sepeda FTR,Kab. Tangerang,250+ terjual,
Outerwear Unisex JB Hoodie Bary Light Brown,Rp199.000,Official JB Store,Kab. Banyumas,80+ terjual,4.8
Hoodie thehundreds original,Rp400.000,Hjseven _Store,Kab. Bondowoso,,
Roughneck HZ023 Maroon Mini Sig White Hoodie,Rp160.000,ROUGHNECK 1991 Official,Kab. Bogor,50+ terjual,5.0
Sweater Hoodie Casual THE NORTH FACE Full Print Full Tag & Label Hitam,Rp299.999,ROUTE88STORE,Bandung,,
JACKET PRIA NIKE WAVEN HOODIE ORIGINAL AUTHENTIC,Rp555.000,jarsport tokoku,Jakarta Selatan,2 terjual,5.0
FUCKING AWESOME CUT OFF HOODIE BLACK,Rp1.335.000,Addiction_inc,Malang,,
pre order Hoodie batik kamen rider kuuga fullprint,Rp300.000,Jefuku,Kab. Cilacap,3 terjual,5.0
Wildtime&Co - Hoodie Blackline Flow,Rp252.000,wildtimeofficial,Denpasar,9 terjual,5.0
Yeezy Hoodie x GAP Dark Grey ( 100% Authentic ),Rp1.690.000,six6street,Medan,,
Descente Original Hoodie,Rp55.000,ThriftUpp,Bogor,,
KUSIKOHC - 'Right To Fail' Racing Jacket Suit SS22,Rp1.975.000,6SOF,Jakarta Barat,1 terjual,
ADLV Emboss Script Logo Blue Green Tee (100% Authentic),Rp899.000,senikersku_id,Jakarta Selatan,15 terjual,4.9
W.Essentiels X One Piece Kaido Button up Shirt Black - XL,Rp529.000,Wormhole Store,Bandung,40+ terjual,5.0
RAMADHAN SALE Patagonia Fleece Half Zipper - Navy Blue,Rp450.000,THA HEATLES,Semarang,3 terjual,5.0
W.Essentiels X One Piece Strawhat Pirate Windbreaker Jacket Black - L,Rp609.000,Wormhole Store,Bandung,2 terjual,4.0
"Hoodie hodie jaket sweater allied kim gimyung webtoon anime - Hitam, XS",Rp130.500,OBY MERCH,Kab. Bandung Barat,1 terjual,5.0
"LinkaweOriginal Jumper Hoodie Kombinasi Pria - Hitam/Marun, M",Rp180.000,LinkaweOriginal,Bandung,,
Custom Hoodie Zipper Pria Jaket Hodie Resleting Jacket Sweater Hoddie Sweter Casual Baju Panas Sweeter Tudung Jersey Jumper Tebal Lembut Hangat Polos Hitam Biru Abu Printing Desain Tulisan Nama Gambar Logo Brand,Rp299.999,MIB Official Store,Bandung,3 terjual,5.0
"No Void Minds AEZY Core xHoodie | Charcoal - Oatmeal, XL",Rp249.900,No Void Minds Official Store,Bandung,80+ terjual,5.0
W.Essentiels X One Piece Kaido Work Jacket Black,Rp1.149.000,Wormhole Store,Bandung,10 terjual,5.0
Roughneck HZ071 Mustard Rochester Zipper Hoodie,Rp160.000,ROUGHNECK 1991 Official,Kab. Bogor,8 terjual,5.0
C.P Company Light Hoodie,Rp1.999.999,sudutpandangstore,Bandung,2 terjual,5.0
JAKET MGEE HOODIE HUNTER C003,Rp1.248.500,famzstore,Kab. Bandung,,
nike center hoodie,Rp1.000.000,metimes id,Serang,,
Livehaf - Popover Hoodie Natural,Rp149.900,Livehaf Official,Kab. Tangerang,26 terjual,5.0
KUSIKOHC - 'Right To Fail' Racing Jacket Suit SS22,Rp1.975.000,6SOF,Jakarta Barat,1 terjual,
ADLV Emboss Script Logo Blue Green Tee (100% Authentic),Rp899.000,senikersku_id,Jakarta Selatan,15 terjual,4.9
W.Essentiels X One Piece Kaido Button up Shirt Black - XL,Rp529.000,Wormhole Store,Bandung,40+ terjual,5.0
RAMADHAN SALE Patagonia Fleece Half Zipper - Navy Blue,Rp450.000,THA HEATLES,Semarang,3 terjual,5.0
W.Essentiels X One Piece Strawhat Pirate Windbreaker Jacket Black - L,Rp609.000,Wormhole Store,Bandung,2 terjual,4.0
Jaket / Hoodie AHHA rose by atta Halilintar Original,Rp1.500.000,Black cut,Bekasi,11 terjual,5.0
Royal Hoodie Zipper Jaket Polos Unisex,Rp64.500,Topone 88,Jakarta Barat,4rb+ terjual,4.8
Essentials Fear of god hoodie ss20 original,Rp1.200.000,TokoKelvintan,Semarang,,
Hoodie DOG TOWN bekas,Rp135.000,jin99a Store,Makassar,,
Stussy Paris Hoodie 100% Original,Rp1.695.000,classichype.id,Medan,1 terjual,
"Rucas Tailor ""D'Rise Of Textured"" Art Painting Hoodie/Shorts",Rp275.000,Thirtyone_store,Jakarta Timur,3 terjual,
Aerostreet Hoodie Hysteria Navy Sweater Jumper CAAAA,Rp159.900,Aerostreet,Kab. Klaten,250+ terjual,
QUADRANT Hoodie Pria Distro Orignal Card Tebal Premium,Rp75.000,Quadrant Official,Kab. Bandung,4 terjual,5.0
Zip Hoodie adidas herzogenaurach,Rp150.000,Wearly Store,Depok,,
SWEATER PRIA NIKE HOODIE BLACK ORIGINAL,Rp495.000,jarsport tokoku,Jakarta Selatan,2 terjual,5.0
Everyday Monogram Sweater - Metal Gray,Rp1.125.000,Dilayani Tokopedia,Buttonscarves,7 terjual,5.0
"No Void Minds AEZY Field xHoodie | Steel - Oatmeal, XL",Rp259.900,No Void Minds Official Store,Bandung,8 terjual,4.7
Stone Island Cotton Jersey Sweatshirt Grey (100% Authentic),Rp6.499.000,senikersku_id,Surabaya,,
CHAMPION FULL ZIP HOODED SWEATSHIRT BLACK - L,Rp1.299.000,Badass Monkey Indonesia,Jakarta Selatan,3 terjual,5.0
JAKET BASEBALL VARSITY WANITA PRIA BIGSIZE JUMBO POLOS S-7XL(XXXXXXXL),Rp110.000,CV.As store,Kab. Blitar,250+ terjual,4.7
Jersey Mancing Shimano Corp Hoodie,Rp500.000,koifishing99,Jakarta Barat,11 terjual,5.0
Hoodie Polos Pria Wanita Hitam Putih Bahan Fleece Cotton Size M-XL,Rp190.000,DEFAULT-322,Kab. Bandung,100+ terjual,4.8
[Original] Hoodie Motor Bikers Ride With Pride - SUPERMOTO#2,Rp325.000,Ride With Pride,Bandung,17 terjual,5.0
Jaket Sweater Eiger X Trople Hoodie,Rp197.800,indonesian_outdoor,Kab. Sumedang,2 terjual,5.0
Wildtime&Co - Hoodie Basic Logo Black,Rp240.000,wildtimeofficial,Denpasar,2 terjual,5.0
Jaket Sweater Hoodie Jumper Outerwear Pria Unisex Prodigo Lingga Hitam,Rp129.999,Prodigo Official,Bandung,24 terjual,4.8
Sweater Hoodie DONT / Jaket Hoodie Pria / Sweater Kasual Pria.COD,Rp62.000,andy fashion jkt,Jakarta Barat,100+ terjual,4.8
EIGER X-MANGROVE 1.0 HOODIE JACKET,Rp422.100,Eiger Adventure Official,Depok,500+ terjual,4.9
Sweater Hoodie Maroon,Rp135.000,hoodie addict,Bandung,15 terjual,4.7
jacket hoodie zipper adidas clfn retro blue,Rp170.000,wadidaw_os,Cimahi,16 terjual,4.9
BAJU CAMO NUSANTARA HUNTING BAJU BERBURU NATURAL,Rp134.900,berburu pakaian camoflauge,Kab. Bandung Barat,16 terjual,4.7
SWEPO Hoodie Jumper Emboss ( Sablon ) M-XXL ( Pria & Wanita ),Rp86.900,SWEPO Official Store,Kab. Tangerang,250+ terjual,4.9
ADLV Baby Face Astronaut Hoodie Black,Rp1.950.000,High Gentlemen,Jakarta Selatan,,
POLO - 7859.38 Hoodie Mens - Navy Bear,Rp229.000,POLO Indonesia Official,Jakarta Barat,16 terjual,5.0
"HODIE BRAZZERS 2xl-6XL - Hitam, 2XL",Rp185.000,FATGOODS,Tangerang Selatan,26 terjual,4.8
hoodie prostreet rider of the wolf ORIGINAL,Rp420.000,RPM (store),Kab. Bandung,3 terjual,5.0
FHM Sweater Hoodie Oversize Hu Tao Pria/Wanita/Remaja/Dewasa Genshin Impact Sweater Hoodie,Rp79.860,AprilliaRahayu,Bandung,2 terjual,5.0
JAKET SWEATER HOODIE BAPE SHARK WGM HYPEBEAST FULL TAG & LABEL UNISEX,Rp249.999,ROUTE88STORE,Bandung,4 terjual,
Hoodie BlacklineArmy Authentic,Rp252.000,wildtimeofficial,Denpasar,4 terjual,5.0
Pakaian Sneakers Adidas Bodega Hoodie Black Original ED7068,Rp1.200.000,Ncr Sport,Bandung,2 terjual,5.0
GLGS | HOODIE BOXY OVERSIZE | STARGOLDSYSTEM,Rp150.750,fayolashop88,Kab. Kediri,1 terjual,5.0
Jaket NBA Hoodie Dallas Mavericks Ukuran S M L XL XXL Katun Adem,Rp155.000,HSCLO,Kab. Blitar,8 terjual,4.8
Stone islamd hoodie,Rp3.800.000,EbrahimOrpus,Kab. Bogor,4 terjual,5.0
Breakside Hoodie Hope Remains - Black,Rp159.900,Breakside,Kab. Bandung,13 terjual,5.0
Pizza of Death Hoodie Jacket Outer,Rp250.000,MAM Markets,Kab. Serang,,
House of Smith Sweater Hoodie Pria - Bruce Black Yellow,Rp99.000,House of Smith Official,Kab. Bandung,19 terjual,5.0
RAW TYPE RIOT - BLACKSQUADSTER HOODIE,Rp550.000,union thrift,Kab. Magelang,2 terjual,5.0
Geoff Max Official - Black On Black II Hoodie,Rp219.000,Geoff Max Official,Bandung,250+ terjual,4.9
Jaket Hoodie Batik Custom,Rp230.000,Klambens Apparel,Semarang,9 terjual,5.0
Hoodie Zipper ARKNIGHTS MOSTIMA [Black] Mos-001,Rp170.000,Tokero Apparel,Kab. Purwakarta,13 terjual,4.9
Hoodie lengan pendek kombinasi 2 warna MOTIF  big size all size L XL,Rp120.000,VINNN CLOTH,Kab. Blitar,,
Sweater Hoodie STUSSY Premium Authentic Full Tag & Label Abu Misty,Rp159.999,ROUTE88STORE,Bandung,2 terjual,5.0
Hoodie Collector Kazamarts 375 - 400 GSM LIMITED Fit Fleece - Banyak,Rp325.000,YolaNurfadhila,Bandung,,
Hoodie carhartt second basic grey,Rp300.000,wahyudin ghenzi,Kab. Tangerang,,
Human Greatness Hoodie Lilac,Rp245.000,Human Greatness Labs,Bandung,100+ terjual,4.9
RUCAS X BIMOPD ZIP HOODIE,Rp350.000,Local Rare Item,Kab. Cilacap,5 terjual,5.0
Jaket Hoodie Pria Custom Full Print Kartun Anak Spongebob - AZ0554,Rp185.000,JES_id,Semarang,4 terjual,5.0
Hoodie Jasad Official,Rp200.000,TO BE HUMAN,Kab. Boyolali,,
Aerostreet Hoodie Hysteria Kuning Sweater Jumper CBAAA,Rp139.900,Aerostreet,Kab. Klaten,100+ terjual,4.9
HUF x Spider-Man Thwip Triangle P/O Hoodie Black,Rp1.054.000,Wormhole Store,Bandung,2 terjual,5.0
ADIDAS X FEAR OF GOD ATHLETICS HEAVY FLEECE HOODIE BLACK (100% Authentic),Rp2.999.000,ONLYSNEAKERS.ID,Medan,1 terjual,5.0
Noforty Sweater Hoodie Japan Culture,Rp105.000,Noforty Project Official,Bandung,6 terjual,4.8
KWAY France Jacques Light Hoodie navy blue jacket  Italy Design designed and developed in italy Lightweight  Size L  PxL : 63x53 Cm,Rp250.000,the royalblue,Surabaya,,
Jaket Hoodie Nike Dri fit Full zip Original,Rp230.000,Fadh Sport,Kab. Bekasi,6 terjual,4.8
Jaket Hoodie Zipper Polos Distro Pria Wanita Fleece Tebal Big size 6XL,Rp95.000,Kliken Id,Kab. Blitar,30+ terjual,4.9
Jaket Dickies bordir/Sweater Hoodie Dickies pullover Terbaru original,Rp73.500,JuraganHoodie_id,Bandung,8 terjual,5.0
Hoodie.In PREMIUM Ozzy Zipper Hoodie - Denim (Unisex),Rp122.999,HOODIE.IN Official Shop,Kab. Bandung,30+ terjual,4.9
Hoodie uniqlo x k-haring second,Rp79.999,Secondchill,Surabaya,,
UNKL347 Jacket Hoodie Misty Model Simpel Bahan Fleece DTZO,Rp110.000,UNKL347 Store,Kab. Karanganyar,11 terjual,4.0
ASLI Custom hoodie black machine murayama High and Low TERMURAH,Rp695.000,hangatstore,Jakarta Utara,,
Russ X Gwan Hee Sweater Hoodie Stars Misty - S,Rp299.000,Russ & Co.,Bandung,9 terjual,5.0
Common Goods Basic Pullover Hoodie - Black - M,Rp185.000,Common Goods,Jakarta Barat,250+ terjual,4.9
Hoodie BP-033 full logoo version grey,Rp598.000,Splitoff-id,Tanjung Pinang,1 terjual,
SWEPO Hoodie Jumper Swepo Authentic (Bordir) Size M-XXL (Pria & Wanita),Rp88.900,SWEPO Official Store,Kab. Tangerang,17 terjual,5.0
Jaket Pria Pullover Graphic Hoodie,Rp299.000,ETC.OriginalSupply,Bekasi,13 terjual,5.0
Jaket Pria Pullover Graphic Hoodie,Rp299.000,ETC.OriginalSupply,Bekasi,13 terjual,5.0
"Hoodie 1HN-001 mummy  - Putih, S",Rp598.000,Splitoff-id,Tanjung Pinang,2 terjual,5.0
Common Goods Basic Pullover Hoodie - Sepia Brown - XL,Rp209.000,Common Goods,Jakarta Barat,40+ terjual,4.8
Jaket Pria Pullover Graphics Hoodie,Rp299.000,ETC.OriginalSupply,Bekasi,12 terjual,5.0
Vearst Pullover Hoodie Dumpty Black on Black - XL,Rp300.300,Vearst Official Shop,Bandung,5 terjual,5.0
JAKET HOODIE ZIPPER RESLETING POLOS BIRU MUDA OVERSIZE M L XL XXL,Rp55.000,POLOS.COM,Bandung,30+ terjual,4.9
sweater hoodie outdoor logo mammut,Rp135.000,phanzshop,Jakarta Selatan,1 terjual,5.0
Jaket Hoodie Tanpa Lengan Sleeveless Hoodie Full White,Rp99.500,the COD STORE,Kab. Sidoarjo,30+ terjual,4.3
jaket sweater jumper hoodie lengan pendek,Rp38.000,fbmarket,Jakarta Barat,50+ terjual,4.7
Hoodie Sweater Jumper Pria Hitam Band Metal Suicide Silence Premium,Rp99.000,nicos merch,Bandung,6 terjual,4.6
Hoodie BP-004 intermiami white - M,Rp598.000,Splitoff-id,Tanjung Pinang,1 terjual,5.0
COSMIC Pullover Hoodie Alright Misty,Rp210.000,COSMICCLOTHES,Bandung,250+ terjual,4.7
CACTUS Flea Market Hoodie Oversize Fit MCD Text Print Unisex Black - S,Rp999.000,Schon Official ID,Jakarta Utara,,
Hoodie K0C'-006 blue motif,Rp628.000,Splitoff-id,Tanjung Pinang,,
Hoodie Pria Front Print NASA - HPRSPC,Rp179.000,CENTER OF ORIGINAL,Bekasi,,
HOODIE ACTION KAMEN SHINCHAN ANIME MANGA SWEATER DJA CLOTH,Rp98.000,DJA Cloth Official Store,Kab. Tangerang,12 terjual,5.0
Moona Hoshinova ch Moonafic Hololive Indonesia Area 15 Holo ID Hoodie,Rp86.000,Antihero Cloth,Kab. Tangerang,3 terjual,5.0
MLB Hoodie,Rp500.000,Hobby Shoppe,Jakarta Barat,,
JDM - Hoodie Polos Jumper Premium Unisex,Rp93.000,Putra Galuh Makmur,Kab.Ciamis,4 terjual,5.0
SWEATER HOODIE UKURAN JUMBO BIG SIZE XXL - XXXL ANTARES CO. ABU TUA,Rp90.000,Antares Store Official,Kab. Bandung,21 terjual,4.8
100% ORIGINAL HOODIE H&M UCLA BLACK,Rp110.000,Popeyesneakers,Depok,30+ terjual,4.7
JAKET HOODIE FULL ZIP BAPE SHARK x UNDEFEATED HYPEBEAST AUTHENTIC,Rp299.999,ROUTE88STORE,Bandung,3 terjual,5.0
Only NY Hoodie Outer Jacket Jaket,Rp230.000,MAM Markets,Kab. Serang,,
FB7922 063 Mens Nike Tech Fleece Full Zip Windrunner Hoodie,Rp1.899.000,Nike Ating,Jakarta Selatan,7 terjual,5.0
Hoodie Ordinary Love Telepati.Che - Limited Edition 100% ORIGINAL,Rp899.999,jeje_jakarta,Jakarta Selatan,2 terjual,5.0
Hoodie 4M11-014 x PM black,Rp598.000,Splitoff-id,Tanjung Pinang,,
PARALEL Sage Hoodie & Jumper Indonesia Adventure Logo Series Black Fleece Soft Keren - Model Hoodie Sweater - Nyaman,Rp150.000,ParalelOutdoor,Kab. Sumedang,1 terjual,5.0
"Hoodie pria pus cat bahan fleece/hoodie oblong distro - Hijau, L",Rp214.900,PAJAMAKO,Jakarta Selatan,,
"Ngab Hoodie Jumper Sablon Reflective Rainbow The Legend Of Samurai King Of Daruma HD014 Hitam Unisex Cowok Cewek Pria Wanita Fleece Tebal Lembut Dan Nyaman Motif Digital - Hitam, XXL",Rp174.999,NGAB LTD,Banjar,,
COSMIC Pullover Hoodie Alright Navy,Rp210.000,COSMICCLOTHES,Bandung,100+ terjual,4.9
Dobujack Neil Black Hoodie,Rp194.000,DOBUJACK,Bandung,10 terjual,5.0
CROP HOODIE OVERSIZE UNFINISHED | RABBIT WOMAN| BLACK | AFTERSUNDAYS,Rp219.999,After Sundays Co.,Tangerang,7 terjual,5.0
Hoodie Homicide - Godzkilla 20th (Back Print) Original,Rp450.000,Fast Merch Store,Tangerang Selatan,17 terjual,5.0
Hoodie Stussy Made In USA,Rp350.000,B-Joe Second.Plat N,Malang,,
Hoodie Stussy blur logo navy,Rp800.000,Selectmarket Id,Depok,,
HOODIE JAKET BAPE A BATHING APE BLACK X BEST MIRROR 1:1,Rp550.000,WIL-OS,Surabaya,11 terjual,5.0
